Src,Time,Rank,Val
OPPO,2021-09-13,1,真的是垃圾，第1次见到APP注销居然要那么多手续的你知道吗？我明明在淘宝下单买的东西，他居然说不能让我注销账户，要15天后来注销，什么奇葩行为呀，我又不在淘客下了单，我在淘宝下了单，关他什么事啊？真的是烦，我去他们那里的意见反馈那里去反馈了，也不见回我什么啊，那你又让我提意见你又不解决给我叫我反馈些什么啊，有病啊。本来今天心情好好的，被为了注销一个淘汰账号那么麻烦，搞得心情差完，气死。
OPPO,2021-09-13,1,客服态度极其恶劣  助力活动 没下载过刚注册淘特的东西助力不成功然后还能领10元新人卷  邀请8个新人成功4个 最差是客服  跟我解释说一实际为准  不管是不是新用户  助力就是  不上就不是新用户  顶我上去  看看他们的嘴脸必须投诉
OPPO,2021-09-13,4,可以送免费东西，挺好的
OPPO,2021-09-13,1,包裹收到里面没货
OPPO,2021-09-13,1,垃圾垃圾，以前的支付宝不用了，绑定了现在的，所有都弄好了，包括上面显示也是绑定的现在的，一付款就跳到以前的支付宝号上了，咋滴！你要给我付钱啊，无语死了，找客服客服也不理，，，。，
OPPO,2021-09-13,5,现在刚用。还不知道好不好。
OPPO,2021-09-13,1,你们这个平台管理不行，有事没人管，和拼多多比差远了
OPPO,2021-09-13,5,强制我五星好评 恶心
OPPO,2021-09-13,1,我没下载啊，怎么自己就安装了？无语
OPPO,2021-09-13,1,什么鬼东西，垃圾
OPPO,2021-09-13,5,特别不错 ，支持马总
OPPO,2021-09-13,5,满意  很好用。
OPPO,2021-09-13,5,我觉得挺好 ，新人十元随便花 ，而且东西也到货了 ，在这里买东西也是最便宜的 其他都很贵
OPPO,2021-09-13,1,有生之年希望能等到
OPPO,2021-09-13,1,广告整挺好，下了就过来给差评
OPPO,2021-09-13,1,谁说可以领红包 真的很差
OPPO,2021-09-13,5,真的免单了好几样东西，建议下载
OPPO,2021-09-13,5,垃圾软件，不良商家
OPPO,2021-09-13,1,养鸡活动 玩不起就别玩！垃圾套路各种！
OPPO,2021-09-13,1,垃圾，只会打广告
OPPO,2021-09-13,1,太恶了，玩萝卜会赚钱，本来都得一个萝卜了，它显示我得网络错误，我又连无线网重新连接，还是显示网络错误，几次下来突然给我退出了，玩不起就不要玩
OPPO,2021-09-12,1,谁下载坑谁，没意思
OPPO,2021-09-12,1,呵呵，不能退款。
OPPO,2021-09-12,1,真的要被气死了，反映的问题根本不解决，每次反馈只会向你道歉，解决都不解决！！！！垃圾
OPPO,2021-09-12,5,这个软件特别好用
OPPO,2021-09-12,1,太假了！！！！！！
OPPO,2021-09-12,1,为什么不能用微信
OPPO,2021-09-12,5,我想问一下，那个新人十元红包是真的吗？用十元红包买的东西，真的可以到货吗？先暂时给个五星
OPPO,2021-09-12,5,这个应用真的特别特别好。我从那里买东西，人家商店关门儿了。已经付完钱了，给卖家打电话是空号。官方不定能几天解决，我也不知道。一定要为这种卷钱就跑的商店。绝对的好评。
OPPO,2021-09-12,5,太好了吧！还在犹豫的赶紧注册吧！
OPPO,2021-09-12,1,这都卸载不掉，你不仁，不要怪我不义我要找猎豹清理大师。！！！
OPPO,2021-09-12,1,"这个淘特也太恶心了吧，我玩着别的软件的，突然跳出来这个广告，而且关也关不上，你一点它它就会自动下载，下载了就会安装，好烦人呢。
先抛开物品好坏不说，就是这种广告，就让人觉得里边儿的东西没什么好的。
希望厂家能改一改，不要再用这种恶心的方式让我们了解到他了。"
OPPO,2021-09-12,1,发货有点慢.。
OPPO,2021-09-12,5,这个软件很好啊，新人有十块钱的券，随便买什么，真搞不懂有些人为什么要弄差评，东西发货虽然很慢，不要白不要，反正也是不要钱。
OPPO,2021-09-12,5,将是不明白那些人为什么要给差评，这淘宝特价版不是很好的吗？
OPPO,2021-09-12,4,其实那些不发货，发慢之类的，是可以打电话给消费者协会的
OPPO,2021-09-12,5,我真是服了，这淘客做广告也太恶心了吧，只不过不小心点到就开始下载了，下载就安装了，我都卸过好多次了，有毛病吧
OPPO,2021-09-12,1,这应用是真的烦，虽然真的有1元手机，但可能都是内部，根本收不到，而且广告也多的一匹
OPPO,2021-09-12,5,感觉很好用，新人可以免费买东西。
OPPO,2021-09-12,5,"给5星好评是为了让更多人看见，一点都不好用，别看里面有那么多的优惠，其实就是买了也不给你发货。八月二十几号买的东西，现在九月一十几号还没发货。客服根本不会理你。 (*꒦ິ⌓꒦ີ)
希望有更多人可以看见这条评论，不要傻傻的就下载了。而且我的这个还不是自己下载的，是它自动安装的，鬼知道怎么回事，突然出现在手机里。跟有病毒一样，太tmd假了。ᕦ༼༎ຶ_༎ຶ༽ᕗ"
OPPO,2021-09-12,4,蛮好的，新人0元就可以买一样东西
OPPO,2021-09-12,5,大好了新人不要钱
OPPO,2021-09-12,1,想想就气，差评差评
OPPO,2021-09-12,1,不行，都不要下
OPPO,2021-09-12,5,挺好的都收到货了不要钱
OPPO,2021-09-12,1,质量很差，客服服务态度差。你们买了就后悔。相信我。
OPPO,2021-09-12,3,我觉得这个还可以
OPPO,2021-09-12,1,很差，确实有1元手机，结果给我发了一堆头套，虚假宣传，诈骗是犯法的
OPPO,2021-09-12,1,新人十元卷，假的吧，要不是最少一星我都不想给，我刚进去，有十元卷刚要下单，变五元运费，在一下子变成0.8元的卷呵呵，下架吧
OPPO,2021-09-12,5,我想问问，有谁知道淘特怎么用微信支付吗。知道的回复。
OPPO,2021-09-12,2,十元买东西确实是真的，但发货速度很慢，客服也服务态度很差
OPPO,2021-09-12,1,无语死了，这是什么应用软件啊？是病毒附身吗？自动安装也就算了，这边正有什么急事呢，那边它突然跳出来，是有病吗？广告也得有点底线吧，耽误别人多少事，知道吗？，如果不是气的很，我为什么来这里浪费时间，在这里评论
OPPO,2021-09-12,5,我买了一个手表一分钱多没花
OPPO,2021-09-12,3,个人觉得还可以（不知道评论区为什么说不好）
OPPO,2021-09-11,5,希望出QQ支付
OPPO,2021-09-11,1,退货里不给我们退货，一直乱发，你稍后等待，耐心等待，一会就发厚度差评，差评差评
OPPO,2021-09-11,1,没意思，还说46，结果只能领十元
OPPO,2021-09-11,1,不好！零颗星，什么破软件！登录还必须要手机号或支付宝，微信都不能！本来 准备删掉的，突然想到回来写个评论，就等写完再删！太太太太太差了吧！！！！要不是不能不弄星星，就是零颗星！
OPPO,2021-09-11,5,我觉得很好的，喜欢这个软件
OPPO,2021-09-11,1,牛马东西，点一下就自动下载，广告多的要死
OPPO,2021-09-11,2,汝仿多多起廉价，尽是鳌头垃劣货，新人10元虽为实，劣质产品囤压货，钰仿他人挣大钱，只会差评下架去！
OPPO,2021-09-11,5,很好。里面的东西很便宜。
OPPO,2021-09-11,1,一点都不好屁用没有
OPPO,2021-09-11,4,我买了两件商品。都是零元买的。两套书，葡萄干。
OPPO,2021-09-11,5,超好用❤❤❤❤❤❤❤
OPPO,2021-09-11,4,还可以吧不能说不好还可以
OPPO,2021-09-11,3,有套路吗？我很想知道
OPPO,2021-09-11,5,新年有免费领取活动，挺好用的
OPPO,2021-09-11,1,淘特太坑了，付款0.83才退回0.3，平台给二元红包，有什么用，还不是叫你下单买东西，东西收到货，卸载了。
OPPO,2021-09-11,5,"xdm，看那个广告说ling手机，其实是个手机壳
呗用╭∩╮"
OPPO,2021-09-11,5,实在是太好了。
OPPO,2021-09-11,1,新人优惠买的商品根本发不到手上，客服态度也很差。本来都卸了，刚下回来写个差评，写完就卸载。辣鸡软件。
OPPO,2021-09-11,1,登陆不进去真的服
OPPO,2021-09-11,1,总之东西很差，不要贪小便宜
OPPO,2021-09-11,1,什么破软件屏幕上写着零元，一进来啊，就变得很多块钱了。是什么破软件啊？
OPPO,2021-09-11,5,这个应用非常的好，这里面你进去就有十元的券，随便买东西只要不超过十元，都是零元购买哟。
OPPO,2021-09-11,3,什么时候开通微信支付？
OPPO,2021-09-11,3,十元红包是真的，但是客服态度真的差，建议大家领了红包就卸了吧
OPPO,2021-09-10,5,只能说一分价钱一分货吧，领些红包买些小玩意挺好的，但是你要是想花1块买100块的质量就想想吧
OPPO,2021-09-10,5,十元免费拿是真的！！四天就收到货了。
OPPO,2021-09-10,5,挺好的，还可以扫描逃跑吧少年兑换码。
OPPO,2021-09-10,5,我觉得好用    一分钱没花，领了两样东西    还有各种优惠券 还有各种满减
OPPO,2021-09-10,3,听朋友说的，所以下载的还好
OPPO,2021-09-10,3,本来很喜欢这个APP的，但不久前遇到一个客服让我特无语，明明是客服搞错信息，耽误了我的事，我本来也没怪她们，就几块钱，想着退款退货就好了，但她们凭什么一次又一次拒绝了我的退款退货申请，我希望客服能好好处理这件事
OPPO,2021-09-10,1,这个软件一点都不好
OPPO,2021-09-10,5,nice！！！
OPPO,2021-09-10,1,不给薅羊毛了，垃圾东西，玩不起
OPPO,2021-09-10,5,这个软件很好啊，新人有十块钱的券，随便买什么，真搞不懂有些人为什么要弄差评，东西发货虽然很慢，不要白不要，反正也是不要钱。
OPPO,2021-09-10,1,垃圾东西，一颗星也不配
OPPO,2021-09-10,1,不管碰到哪都自动下载？钱都用来做宣传了吗？本来就用不着这个软件，越这样越烦人
OPPO,2021-09-10,5,这桃色真好用，拿来吧你。
OPPO,2021-09-10,1,打开个芒果TV莫名其妙跳转商店给我下载这个APP，吃饱了撑的真是
OPPO,2021-09-10,1,虚假发货  商家发货了没有物流信息  半个月了
OPPO,2021-09-10,1,无语了垃圾软件
OPPO,2021-09-10,2,十元买东西确实是真的，但发货速度很慢，客服也服务态度很差
OPPO,2021-09-10,1,快递到了我立马删软件
OPPO,2021-09-10,5,我上线不要钱就领了东西本已为是骗人的但竟然收到了，搞不懂给差评的那些人，唉...
OPPO,2021-09-10,5,很好，花0元买了个手机是真的
OPPO,2021-09-10,1,买完东西客服就不理人了 需要改地址找客服找了半天 最后说可以改 等了一天也没改 再找人发消息不回复 打电话也没人接 还说我的快递代取件了 我根本没在家 哪有人去取件 也不退款也不改地址 差评 ！！！！！！！便宜是便宜 客服不咋地
OPPO,2021-09-09,1,这陶特的物流太慢，一等就是3个星期，差差差评
OPPO,2021-09-09,5,我觉得可以的没必要差评
OPPO,2021-09-09,5,领了200，太好了吧！
OPPO,2021-09-09,1,太拉了，垃圾软件，建议不要下载
OPPO,2021-09-09,5,"xdm，看那个广告说ling手机，其实是个手机壳
呗用╭∩╮"
OPPO,2021-09-09,1,跟宣传的根本不一样嘛
OPPO,2021-09-09,5,非常棒，非常好，我非常喜欢建议大家去下载
OPPO,2021-09-09,1,卖家骗子太多 虚假发货 发货了也收不到 要不就是故意给的别人的单号 其实没发货
OPPO,2021-09-09,1,广告打的怪漂亮，全是套路！！
OPPO,2021-09-09,2,汝仿多多起廉价，尽是鳌头垃劣货，新人10元虽为实，劣质产品囤压货，钰仿他人挣大钱，只会差评下架去！
OPPO,2021-09-09,5,淘特app真的非常好！建议大家都去下载
OPPO,2021-09-09,1,就很离谱这个软件。
OPPO,2021-09-08,1,什么app，要客服没客服，申请退款还拒绝，物流还慢，
OPPO,2021-09-08,3,不能微信支付，其他还可以
OPPO,2021-09-08,4,不能微信支付这个不满意
OPPO,2021-09-08,1,买假货的很多......
OPPO,2021-09-08,1,不好用，必须登录陆才能用。
OPPO,2021-09-08,3,老是进不去 ，无语
OPPO,2021-09-08,1,这是我见过最差的APP
OPPO,2021-09-08,1,垃圾应用，都别下载了
OPPO,2021-09-08,1,全部都是虚假发货，买的东西一个都没收到
OPPO,2021-09-08,3,"有时候打开的时候刷新不了， 仍然是以前的东西， 
希望更新更多的版本，容易卡 。"
OPPO,2021-09-07,5,淘特App是骗子App！我9月2号在淘特App上买了打底裤！有订单！没有货！在淘特App上怎么也查不到货！在支付宝上查到了己付款！但支付宝App袒护淘特App！是不是这两个App是同一人！都是骗子？都不要下截淘特App！骗子淘特App！
OPPO,2021-09-07,1,我登录了半天都没登录进去。而且那个验证码半天都没发过来。.·´¯`(>▂<)´¯`·.
OPPO,2021-09-07,5,为啥总是显示异常
OPPO,2021-09-07,1,不好建议大家不要下载，要登录半天才能整好。这是我给你们的评价，希望你们不能浪费流量来下载这些不值钱的东西。
OPPO,2021-09-07,1,客服很差劲o，不处理问题只会推责任，自己设置的价格不发货，笑死根本不如拼多多，退了退了，球球赶紧下架吧，这种软件怎么配上架的呀~
OPPO,2021-09-07,3,除了发货慢，其他的都还可以
OPPO,2021-09-07,5,我觉得好用    一分钱没花，领了两样东西    还有各种优惠券 还有各种满减
OPPO,2021-09-07,1,，不是给我一个10块钱的券嘛  我就去找耳机，我找到了，但是不是我看好的  付款过后，新人礼包里面一下跳出来我想要的  然后我就退款，退款过后我回去找翻了半天就是找不到 嘻嘻 乐死我了
OPPO,2021-09-07,1,用优惠劵买东西不发货大家举报到工信部，淘宝特坑版骗子软件
OPPO,2021-09-07,1,说好的拉3个新人给50块钱，拉了第3个时说他不是新人，但他又有新人福利，没办法就拉了第4个朋友，结果也有新人福利，但就是不给我50块钱，套路太深了，完全是骗人的，找客服一开始说能解决，后面一直拖，然后说解决不了，浪费我一堆时间，腊鸡应用，换货还要自己去寄，某夕夕自己上门取件比这个好多了
OPPO,2021-09-07,3,买了两个东西都是免费的，货还没到，不过发货挺快的，就是不能用微信支付，我支付宝上没有钱， 还希望改进一下
OPPO,2021-09-07,5,"xdm，看那个广告说ling手机，其实是个手机壳
呗用╭∩╮"
OPPO,2021-09-07,2,也就10元券有用，可是我用券买的东西买了一个月还没给我发货，问了商家也说其他原因，真的无语，买东西发货慢死了，用了几天就删了
OPPO,2021-09-07,1,新人买不了官方补贴，购买按钮点不了，呵呵，淘宝玩不起就别玩
OPPO,2021-09-06,1,都是假商品……
OPPO,2021-09-06,1,财神领红包最后一个永远不是新人 你细品
OPPO,2021-09-06,5,我觉得非常好  东西还便宜 货三天就到了  发货也很快 还有新人十元优惠券
OPPO,2021-09-06,1,骗人带点脑子哟，xswl，半天不给订单号，你要我怎么拿？跑商家那拿呢？你可真牛*******
OPPO,2021-09-06,2,为什么不能用微信支付？我没有下载支付宝，就算下载了也没钱啊
OPPO,2021-09-06,5,都还可以吧，就是发货有点慢
OPPO,2021-09-06,1,特别差，别问，直接看其他人评论
OPPO,2021-09-06,1,第一次用淘特，实话是除了价格便宜其他都不如淘宝，很恶心的一次购物体验，以后不用淘特了。就买了一个包和临时停靠的车贴。包还好，到了。临时停靠的车贴要多恶心有多恶心。两次跟客服沟通催促都被告知等不及就申请退款，第二次沟通之后我就申请退款并未处理，我在别家已经买过了车贴。十天之后的现在我发现还未给我处理退款我又去跟客服沟通人家在我明确告知已在别家买过同样的东西并已到货的情况下还是就跟听不懂我的话一样没有正面回复，就只嗯嗯啊啊的敷衍，我特别生气的问她是不是听不懂我说话？为什么没有明确的正面回复才给我退款。从下单到现在已经二十五六天了，从发现物流信息不更新到现在我已经跟客服沟通了三次客服都明确告诉我等不及就申请退款，两次申请退款客服都并未处理！这样的软件以后是真的不敢再用了。网购用过很多软件，这是最差的一款，从未生气到这种地步，也从未给任何商家或软件差评过，这是第一次！
OPPO,2021-09-06,1,玩个游戏都有这个广告，今天喝凉水塞牙，差评。
OPPO,2021-09-06,1,买了个杯子，盖子坏的，说会补发一个盖子，结果两个礼拜左右过去了，啥也没有看见，只会拖延时间，退货了，还要自己承担运费
OPPO,2021-09-06,1,全场通用的红包买东西不能用。真厉害，马牛x真行
OPPO,2021-09-06,1,如果有零星那我一定給他零星
OPPO,2021-09-06,1,助力不成功，说什么账号异常，请你们解决一下，谢谢
OPPO,2021-09-06,2,我以为我进入了拼多多
OPPO,2021-09-06,1,"我不知道是手机问题还是系统操控，我填姓名 地址，根本打不了字，一个字母句号都打不出来，我都服了，还什么新人免费，免泥🐴批，那客服像个只有几口气一样，回个信息还得去医院换个氧气瓶，慢得要死，真无语O__O""…  真心建议你们不要下载！！！不要下载！！！不要下载！！！"
OPPO,2021-09-06,1,简直是垃圾到不能在垃圾，按他规定完成任务最后说我违规
OPPO,2021-09-06,5,感觉这个软件很好用。
OPPO,2021-09-06,1,骗人，还说什么20的一大堆，压根一个没有
OPPO,2021-09-06,1,你们该治一下那些骗子，我买了一件仲丁灵20瓶，他们收了我20瓶的钱，却只给我发了一瓶药，找他他电话打不通，他们只知通挣钱，不讲信用
OPPO,2021-09-05,4,为什么不可以微信支付呜呜呜呜
OPPO,2021-09-05,1,真的要不是不让0星我就0星了
OPPO,2021-09-05,1,什么垃圾软件，不是说可以领钱吗？真的是服了这些广告。
OPPO,2021-09-05,4,爱了，爱了 里面几乎都是免费的
OPPO,2021-09-05,4,挺好用的，希望可以出微信支付
OPPO,2021-09-05,1,明明都说货到了，但是没有这就很离谱了！
OPPO,2021-09-05,4,还是可以的，有好多优惠，新人可以免好多钱，还是可以的。
OPPO,2021-09-05,5,很不错啊！！！！！！
OPPO,2021-09-05,5,挺好的啊 不明白为什么这么多差评 有些人用完免费给的优惠券就差评 起码有点良心 好吧
OPPO,2021-09-05,5,还可以吧这个啊
OPPO,2021-09-05,5,好评好评两个字好用
OPPO,2021-09-05,1,真是的，我下载它，然后登录就登了十几分钟，进去之后还一直卡，我真是无语死了，真是一星都不想给
OPPO,2021-09-05,5,里面买东西很便宜 ，非常好
OPPO,2021-09-05,1,一星好评........
OPPO,2021-09-05,5,还没用呢，应该挺好的吧
OPPO,2021-09-05,5,新人优惠太多了，还有些免费的商品比隔壁拼多多要好多了！
OPPO,2021-09-05,1,切换账号困难，前两天还不这样
OPPO,2021-09-05,5,添加一个微信支付吧
OPPO,2021-09-05,2,都还可以吧，就是发货的有点儿慢，去催商家，商家也不理，希望快点改正
OPPO,2021-09-05,1,新人的东西，物流迟迟不到，问客服，直接让我退款，好不容易享受新人首单，却让我退款，你这明显是骗人的
OPPO,2021-09-05,4,我觉得比较好，因为他有零元特价
OPPO,2021-09-05,1,辣鸡东西，只能支付宝
OPPO,2021-09-05,5,牛掰，送了一张VIP卡
OPPO,2021-09-05,5,新人登录还有零元的东西
OPPO,2021-09-05,1,东西根本抢不到
OPPO,2021-09-05,5,很好啊，在里面白嫖了好多东西
OPPO,2021-09-05,1,实在话 一星我都懒的给 什么东西 搞不懂 拼多多都比这个好 买东西都是假的 便宜太便宜了 便宜的我都不知道什么叫虚假
OPPO,2021-09-05,1,很差，广告太多
OPPO,2021-09-05,5,可以微信支付的，只是要切换支付方式
OPPO,2021-09-05,1,为什么它就是会物流异常呢？？
OPPO,2021-09-05,5,我觉得商家服务态度很好，两个地址写错了都给我改，拼夕夕商家直接照着我骂。
OPPO,2021-09-05,1,好多都是假的垃圾
OPPO,2021-09-04,3,要是微信也能就好了  有的学生党是没有支付宝
OPPO,2021-09-04,5,跟盗版的一样，给五星完全是因为这个软件太low了，想让更多人看到
OPPO,2021-09-04,1,打游戏时经常看见它的广告，一看就是大品牌
OPPO,2021-09-04,5,为什么没有微信转账啊啊啊啊
OPPO,2021-09-04,1,千万别下栽！！！！！！！
OPPO,2021-09-04,5,这个软件挺好的
OPPO,2021-09-04,1,骗人的好不，还说可以领优酷会员，骗人没必要这样吧。
OPPO,2021-09-04,1,我下载纯属是为了开个画质助手
OPPO,2021-09-04,1,真不知道给5星的那些人是怎么想的，肯定是被淘特给收买了，登录搞得那么磨磨唧唧，最后登录都登不了，我给他负1亿星。
OPPO,2021-09-04,1,我在淘特上买的东西表面上是到货了并且已签收结果去快递店一查人家工作人员告诉我这是个虚假发货，商家一直都没有发货，并让我联系商家，我奇怪了没发货为什么快递一直有显示，并且还签收了？
OPPO,2021-09-04,1,个人感觉不是很好
OPPO,2021-09-04,5,里面的东西特别便宜 ，还实惠 ，特别好用 ，我强烈推荐
OPPO,2021-09-04,1,垃圾东西，还实用便宜，别人新人优惠10块，我新人优惠一毛，啥意思？瞧不起我？
OPPO,2021-09-04,5,好评好评，真的特别好，东西特便宜，还有很多优惠卷
OPPO,2021-09-04,1,垃圾垃圾垃圾，总是自己进去。什么玩意！
OPPO,2021-09-04,1,太差劲了，服务不好商家还骂人，退款也很慢，烦死了，早知道不下载了，退款回来卸载了。
OPPO,2021-09-04,4,好是好就是不能用微信付款，其他都很好，推荐
OPPO,2021-09-04,3,这钱提现到哪里去了？
OPPO,2021-09-04,5,非常好用，新手还免费，大多数的东西都比别的平台便宜。
OPPO,2021-09-04,3,"刚开始看到有那个零元抢购确实挺开心的 但是那个零元抢购就在第二天凌晨 他就过期了
我根本就没来得及用 
而且支付也只能支付宝 我觉得还不如拼多多呢"
OPPO,2021-09-04,1,巨烂！！！！！！！！虚假宣传！！！！！！真的别信！！！！！
OPPO,2021-09-04,3,还行。。。。。
OPPO,2021-09-03,5,为什么没有微信支付呀？求求了添加个微信支付吧
OPPO,2021-09-03,1,买小玩意儿确实是挺实惠的 里面每天签到还有红包和现金拿 但是购物体验不满意 部分商家售后真的极差 商家发过来的东西已经烂了 我说能不能重新补发呢 商家要求我直接退款  可我当时用的优惠券买的啊 退款之后那优惠券也过期不能用了 商家的态度就好像是随便你退 反正你退了就只退给你几毛钱 也不给你解决了 淘特建议像淘宝那样 退款之后优惠券有个延缓期
OPPO,2021-09-03,4,商品都挺好的，为什么只能用支付宝付款？拼多多都比你们好。 （QQ呀，微信呀，找好友支付呀，还有支付宝呀），应有尽有。都可以支付。
OPPO,2021-09-03,1,卖菜越办越不好了，显示菜到点取，但到地方都没有到，这算不算虚假广告。
OPPO,2021-09-03,1,一个人让我帮他主力连精神损失费都没有
OPPO,2021-09-03,1,别问我为什么给差评，服务态度太差了。我买了一个东西。我跟他说有急用，然后呢，哪怕他稍微回一下也可以啊，可他回都不回。然后呢，隔了一段时间后以后我去看了一下我这个快递一看，哎呀，不得了了。还没发货。靠。我在拼多多上买东西的话，我问人家，人家很快就会回的呀。不像这个回都不回一下，气死个人。咋滴，你是客服还是我是客服？还不带回了？回一句话能死。 我不给你差评，谁给你差评。
OPPO,2021-09-03,1,真的是一分都不想给！兄弟们，姐妹们，如果看到我这条评论，千万千万不要下载。我之前都给卸载了，刚刚想到来评论一下，又下载之后评论。这里面别的不说，首先是因为一件产品的售后，然后让我知道他们的官方客服如此的无语，跟我沟通时他们换了几个“专员”，结果都是一个人！还跟我说她们去跟商家沟通。24小时之内给我回复让我等待，我隔了一夜之后问她还是依旧的说换专员处理！换来换去还是一个人（因为上面有头像显示），然后我再去问商家，商家说根本就没有所谓的官方客服去跟他们商家客服去沟通。就是在敷衍消费者，欺骗消费者，这样的官方客服在这儿，他这个app能好到哪去呢？
OPPO,2021-09-03,5,"All good things are cheap, all bad things are very dear
一切好的东西都是便宜的，所有坏的东西都是非常贵的"
OPPO,2021-09-03,5,东西真的超便宜，还有抵用券，缺点就是不能wx支付
OPPO,2021-09-03,5,非常好，质量非常好，还能免费，新人用户还能免费，还能挣钱，请大家去下载，
OPPO,2021-09-03,1,什么应用全是套路
OPPO,2021-09-03,5,不错的商品。很给力
OPPO,2021-09-03,1,不是说新人可以1元购买手机？骗子。
OPPO,2021-09-03,4,挺好的，就是不能用微信支付，要是有我早就买很多东西了，这个我只能领了劵0元
OPPO,2021-09-03,5,我在淘特花了0元买了3件东西，集美们放心冲吧
