Src,Time,Rank,Val
OPPO,2021-05-26,1,一颗星都不想给，什么垃玩圾玩意。
OPPO,2021-05-26,1,一星都不想给   什么垃圾软件    还特价版   价格也不便宜  甚至还贵    垃圾垃圾垃圾重要的说三遍
OPPO,2021-05-26,1,垃圾软件来的，又有小的病毒，买两个快递取了一个，他那里还提示有两个
OPPO,2021-05-26,1,太差劲了，秒杀的时候总说活动太火爆，再过一会就抢光了，真的好齐，抢到的人是咋做到的
OPPO,2021-05-26,1,太假了，都抢不到都说活动太频繁，都进不去
OPPO,2021-05-25,3,真的还可以，广告也没有。
OPPO,2021-05-25,1,"真的垃圾，现在都在向拼多多看齐嘛？
能不能整治一下，全是广告。"
OPPO,2021-05-25,5,这里，无马，无马，没有马赛克，什么都有
OPPO,2021-05-24,1,一直在自动跳出活动页面，你推出活动页面就自动再转回活动页面，返回、重启、清除缓存都不好使，卸载
OPPO,2021-05-24,2,不好用，不建议下载
OPPO,2021-05-24,1,还没下载，先给个差评吧
OPPO,2021-05-24,1,骗人，广告太假了
OPPO,2021-05-23,3,乖乖，名字改了淘特
OPPO,2021-05-23,1,一元买手机  电视机是不可能的，广告是哄人的。
OPPO,2021-05-23,1,无赖广告。。。。
OPPO,2021-05-23,5,集美们真的很好用，可以0元拿货，快下载吧！
OPPO,2021-05-23,3,正常啊，还行👌👌👌👌
OPPO,2021-05-23,5,极力推荐这个，聊天 交友 约会 各种玩法陪你玩，深夜必备！
OPPO,2021-05-22,1,一股拼多多的气息扑面而来
OPPO,2021-05-22,1,不要出现，招人烦
OPPO,2021-05-22,1,什么破东西根本就没那么便宜吗不建议大家下载。
OPPO,2021-05-22,1,不是一般垃圾，开始有一两块的券，后面比淘宝都要贵，而且发货极其慢，商家态度差到极致，质量价格都还不如拼多多
OPPO,2021-05-22,1,快递都邮错了，不好。
OPPO,2021-05-22,5,很好我才下载，送我几块钱的劵，已经免费买了两件商品了。至于楼下有人说，以后越来越贵，没免费。那我来说，人家是商人，刚开始给你垫钱，已经很不容易了。毕竟有很多人，都免费买了，这垫的钱积少成多，人家也不容易。
OPPO,2021-05-22,5,做广告的人真有才，在视频里头加个跳过 真厉害
OPPO,2021-05-22,1,不好用很不好。千万别下
OPPO,2021-05-22,1,垃圾我一星都不给
OPPO,2021-05-22,1,开始那两天还便宜，后来就越来越贵。做任务可以得劵，任务做完了，结果劵没了，反正就是让你兑换不了。满满的套路，慎重下载！！！
OPPO,2021-05-22,1,垃圾，垃圾，垃圾
OPPO,2021-05-21,1,根本就没有一块钱买手机活动，用上买了物流也看不见，质量也很差，内存占的又多，要不是我花了一块钱在上面买了个手机，我现在都把它卸载喽，因为上面写着25个工作日发货，然后我过25天后再没有见发货，我就直接卸载它，差评举报，我说到做到，到时候一定会举报这个淘宝的。
OPPO,2021-05-21,5,可以采纳我的建议，改名淘兔，很贴切
OPPO,2021-05-21,5,非常不错。免费拿了很多东西是一款良心软件。而且里面的东西都非常便宜。可以用。特币抵扣。
OPPO,2021-05-21,1,软件更新后 就没有我的订单了
OPPO,2021-05-21,1,什么玩意，比拼多多还差劲，够够的
OPPO,2021-05-20,1,送货快到的时候就变成了打不开了。打开了又自动退出。几十块的东西都没到手，找物流也没办法找。贪小便宜吃大亏呀。
OPPO,2021-05-20,3,还行，就是不能用微信支付，不联系下载
OPPO,2021-05-20,5,可以可以，里面东西都很便宜
OPPO,2021-05-20,1,就是一个低配版的拼多多，客服和产品质量还不如拼多多
OPPO,2021-05-20,1,新人1元买手机，是假的，我付款成功了，上面显示发货了，就是收不到货。
OPPO,2021-05-20,1,欺骗消费者  一分钱邀请新人最后收取运费  推卸责任
OPPO,2021-05-20,1,笑死  根本抢不到
OPPO,2021-05-19,5,这个就是阿里的并夕夕啊
OPPO,2021-05-19,1,真垃圾了，买个东西6天不发货，咨询卖家还不回复。垃圾
OPPO,2021-05-19,3,改名了，这个名字洋气
OPPO,2021-05-19,1,改名了？啥时候的事我都不知道！😄
OPPO,2021-05-19,5,我想要这款行车记录议，实在太好了，美丽大方，又实惠，值得可买，我给评五星级产品！
OPPO,2021-05-19,2,以前的卷随时都可以兑换还挺好的，现在的卷压根就抢不到了，天天签到得了好多币就是抢不到卷兑换不了，就是没用，新人还是不要下载了
OPPO,2021-05-19,1,为什么会出现活动太火了？什么原因？为啥你就是不想给手机，你是不是骗人的，还阿里巴巴你骗子。你不是说一元购手机吗，你骗人吗？你这软件是不是全是骗人的啊？你在抖音里说一块钱可以买到手机，你是不是在糊弄我，你说说。
OPPO,2021-05-19,1,说好一元抢物，老子花钱买的一元购物资格说没就没了。
OPPO,2021-05-18,5,这淘宝特价版太好用了，我十分满意。
OPPO,2021-05-18,1,存在虚假宣传，而且涉嫌很多广告侵权，一不小心就买到假货
OPPO,2021-05-18,3,感觉比拼多多好
OPPO,2021-05-18,5,很好用很喜欢。
OPPO,2021-05-18,1,假的，天上不会掉馅饼
OPPO,2021-05-18,5,不能随声附和，用过才知道，还算可以，大家理性一点
OPPO,2021-05-18,1,未购买，期待收货
OPPO,2021-05-18,1,啥也不是    不是说可以一元抢手机吗    就这？我一颗星都不想给
OPPO,2021-05-18,1,一块钱的手机是骗人的，说是每天八点开抢，结果抢都抢不了，还说，活动太火爆，待会儿再来，一分钟没到，我一来出去后一进去里面的商品全没了
OPPO,2021-05-17,1,不要下载太坑了，这个软件里面什么东西都要钱(ﾉꐦ ⊙曲ఠ)ﾉ彡┻━┻
OPPO,2021-05-17,5,这里开车了，老司机，无马，无马，没有马，赛克
OPPO,2021-05-17,1,垃圾软件自己下载
OPPO,2021-05-17,1,"卖的东西都是特别便宜的东西根本没有什么特价之说，除了第一次购买有一个五元的优惠券之外啥也没有了，一元抢也是骗人的要拉人才可以，东西都很一般没有买的欲望。而且一用这个软件就卡的要命，别的软件从来不这样。差评
刚刚我还发现一个问题，就是你在淘宝上买东西的的任何信息都会在特价版上都显示一遍，感觉自己就是个透明的，小蜜告诉我他们是有关联的，想想都觉得可怕。"
OPPO,2021-05-17,3,我付了19.90元电动车钱，和30元抢50元话费钱，钱已收了，怎么到现在还没有给我发信息啊？
OPPO,2021-05-17,1,一块钱秒杀骗人的吧！今天我居然坐在手机面前，我都没抢到，难道我比其他客户都特殊吗？凭什么给我再试一次？
OPPO,2021-05-16,1,为什么不能微信支付
OPPO,2021-05-16,3,特价鸭类似合成大西瓜的游戏怎么下线了，小游戏怎么下架了
OPPO,2021-05-16,5,质量好，服务态度好
OPPO,2021-05-16,5,这款APP真的太好用了，推荐使用
OPPO,2021-05-16,1,太差了 ，你这也不好用
OPPO,2021-05-16,1,我连一星都不想给这个垃圾软件  在里面买吃的比超市里买的还贵而且少  给客服说把货退了钱还不给我发信息也不回
OPPO,2021-05-16,1,很差劲👎🏻差劲👎🏻👎🏻👎🏻👎🏻
OPPO,2021-05-16,5,真的有一块钱领取。
OPPO,2021-05-16,1,什么烂软件都是骗人的
OPPO,2021-05-16,1,都是假的，谁下载谁倒霉。那客服是十分钟回一次信息的
OPPO,2021-05-16,1,什么垃圾软件 全是骗人的写好评的全都是他们自己人，一元抢购也是假的。
OPPO,2021-05-15,1,骗子，根本就是骗子，根本就没有一元好物，大骗子
OPPO,2021-05-15,5,没有一块的东西，别想了
OPPO,2021-05-15,1,差评都是假的不要下了
OPPO,2021-05-15,1,现在兑换了红包怎么要48小时到账？那要急着买怎么办呢？还要等？？？
OPPO,2021-05-15,1,只有骗人，没有真实，就搞不懂上面的话是怎么让你相信的
OPPO,2021-05-15,5,很好用，有些都是免费的
OPPO,2021-05-15,1,不小心点到广告下载了，垃圾垃圾
OPPO,2021-05-15,5,不是挺好的吗？我都已经买了两件都是免费的。
OPPO,2021-05-15,5,我要一元抢电动车
OPPO,2021-05-15,1,太差了，登录都登不进去
OPPO,2021-05-15,5,"这里美女啥都给看，很开放，同城直接哟
这里美女啥都给看，很开放，同城直接哟"
OPPO,2021-05-15,1,真的一星也不想给什么垃圾啊到货不给取货码直接给你签收
OPPO,2021-05-15,5,新登录真的0元买东西
OPPO,2021-05-15,1,垃圾软件，还登录，登都登不上去，呸垃圾
OPPO,2021-05-15,1,骗子，说下载一元抢钓箱，根本没找到
OPPO,2021-05-14,5,很好我先升到主宰。
OPPO,2021-05-14,3,闪退进不去，应该是手机的原因
OPPO,2021-05-14,5,非常的棒，简直不要太棒。
OPPO,2021-05-14,1,别下载，客服天天打电话过来，早、中、晚三次
OPPO,2021-05-13,1,差评强制安装不要安装
OPPO,2021-05-13,5,我感觉这种软件只有这个是真的又省钱。
OPPO,2021-05-13,1,好评是水军吧，不好用，特差，建议不要下载
OPPO,2021-05-13,5,这里不错，开车，开车，无吗，无吗哦，
OPPO,2021-05-13,2,什么东西?为什么不能用微信支付?东西倒挺便宜的。
OPPO,2021-05-13,3,发货能不能快一点？
OPPO,2021-05-13,2,软件可以，但是物流也太慢了吧
OPPO,2021-05-13,1,不支持微信支付
OPPO,2021-05-12,1,太垃圾了，卖家不发货，客服不解决问题让退货。合着就是给你个优惠券骗你下载来了
OPPO,2021-05-12,1,特别垃圾，对买家完全没有保护。不作为！保护卖家跟卖家是一伙的。
OPPO,2021-05-12,1,一颗星都不想给垃圾的要死
OPPO,2021-05-12,1,好垃圾，送的玻璃茶壶是碎的，送快递还送错地方
OPPO,2021-05-12,1,不能不要搞这种强制下载
OPPO,2021-05-12,1,气死我了，淘宝特价版把我的评论删掉了！套路多基本都是模仿某多多和某喜的，界面很难看！淘宝特价版的吉祥物龅牙兔也太丑了！里面产品的质量一言难尽！我跟你说啊，这个淘宝特价版的新名字叫淘特，明明就删减了几个字而已，有什么变化？
OPPO,2021-05-11,3,特价鸭合成泡泡游戏怎么下线了，小游戏怎么下架了
OPPO,2021-05-11,1,很不好十分恶心，进不去发货慢
OPPO,2021-05-11,1,越来越差劲，养小鸡兑换商品的，现在是越来越差劲。
OPPO,2021-05-10,4,比拼夕夕好一点，至少我买的到货了
OPPO,2021-05-10,1,骗子都没收到，没有发到，商业骗子，回复也特别慢，客服不怎么好，回应迟钝不回？客服服务，很差
OPPO,2021-05-10,5,超级好，可以省钱
OPPO,2021-05-10,5,挺好用的，东西便宜，质量不错，优惠多
OPPO,2021-05-09,5,非常好用，里面非常多的东西是免费的，我还领了21米可为啥评论里都是一些差评呢
OPPO,2021-05-09,1,特别差  一点都不好用
OPPO,2021-05-09,1,建议大家不要下载。
OPPO,2021-05-09,4,主要是内存比淘宝轻很多，加载速度好像更快一些，新人有优惠，其他没什么厉害的，如果有优惠的话，请和拼多多的对比一下
OPPO,2021-05-09,5,都挺好，东西便宜，就是物流慢
OPPO,2021-05-09,1,什么都不是差评。
OPPO,2021-05-09,3,就差一点儿 他是微信不能支付
OPPO,2021-05-09,5,炒鸡棒，简直就是女孩子的天地，发饰什么的几块钱就可以买到
OPPO,2021-05-09,3,还不错可以下载。
OPPO,2021-05-09,1,骗人！怎么拿的啊？怎么回事？
OPPO,2021-05-09,1,特别次，根本没法用，4.11号买的，4.30号发货，5.8号到货，5.9号别人取出，收件人和地址都不是我，白白等了一个月，客服态度也很次，都是自动回复
OPPO,2021-05-09,1,"有很多程序都是要登录或者 获得验政码，验证码获得不了。想帮助也不行，只卖一元的东西都比较少。电视里吹的倒好有很多卖一元的，吹的真实。可是实际上是假的。😡就知道天上不会掉馅饼。还说什么是源头货，我呸！都是骗人的。
直接给个差评，差评，差评。"
OPPO,2021-05-09,2,今天是怎么了，签到页面打不开。各种游戏页面也打不开
OPPO,2021-05-09,1,没啥可说的，差评就完了
OPPO,2021-05-08,1,怎么说呢，骗人的，别信了吧。
OPPO,2021-05-08,1,我想问和拼多多有什么区别？
OPPO,2021-05-08,1,假的一模一样。。。
OPPO,2021-05-08,1,不能一元免费拿骗人的
OPPO,2021-05-08,1,根本就不能免费拿，骗不死你。
OPPO,2021-05-08,1,直接一个大差评，为啥呢，里面买假货的商家太多了，而且客服一个比一个差
OPPO,2021-05-07,5,这个软件。完全很便宜。
OPPO,2021-05-07,1,差评，我的账号登不了，凭什么我同学跟我同龄，他可以登录，而我却不行，你们能给一个交代吗？
OPPO,2021-05-07,1,很差很差，可以说是非常差网上说一元就可以买东西的更是不可能，大家千万不要下
OPPO,2021-05-07,1,立即领取等到8点，然后活动太火爆稍后再试？？？？？笑死我了，哄堂大孝家人们。服务器不行建议换了，换不了建议取消活动。搁哪打广告恶心谁呢。
OPPO,2021-05-07,2,这是什么软件？我想拿微信支付都没有微信支付，还没拼多多靠谱
OPPO,2021-05-06,1,垃圾不能在垃圾了
OPPO,2021-05-06,5,非常的好用，这是我用过最好用的软件。
OPPO,2021-05-06,1,我从视屏刷出来的说的一块钱可以买一个手机，都是骗子再也不相信那先广告了
OPPO,2021-05-06,3,里面东西价格有便宜，也有贵的，东西质量不太好！
OPPO,2021-05-06,1,收不到货，我买了东西都就没有进过淘宝特价和淘宝，快递快到的时候，什么都看不到，购买记录，物流信息都看不到了
OPPO,2021-05-06,1,越来越垃圾了，卖家故意发错货，平台都不管理，看来这个软件不长久了，快到头了！
OPPO,2021-05-06,1,我吐了 一直给我跳到别的界面去 无语了
OPPO,2021-05-05,1,买了东西显示已签收，但是我没收到货电话也打不通，官方电话也显示空号，这是专门骗钱的吗，虽然也就二十几块钱不多但是你这样不是网络诈骗？
OPPO,2021-05-05,5,我真的不是托！我花了不到五块钱买了九个东西！！不是托！有截图！
OPPO,2021-05-05,1,登了好几次，验证码都不发！
OPPO,2021-05-05,1,差评！登录几次了，都不发验证码
OPPO,2021-05-04,1,你买东西登录的时候可以淘宝一键登录，你想退货的时候就不能淘宝一键登录了，你就得用手机号登录而且你还登不上。卖家故意发错货而且还联系不上，不止我一家收到的货不一样。
OPPO,2021-05-04,1,为什么要钱垃圾
OPPO,2021-05-04,1,什么破玩意     。。。
OPPO,2021-05-04,1,这个软件我也服了 一星都不想给
OPPO,2021-05-04,1,一点都不好用。千万不要下这个软件。要不是要点星才能评论，不然我跟你点星。
OPPO,2021-05-04,5,极力推荐，想看任何都可以，聊天、交友、约会、都可以
OPPO,2021-05-04,5,特别好用！！！
OPPO,2021-05-04,3,没用过先给个三星
OPPO,2021-05-04,3,还可以只不过商家不肯发货
OPPO,2021-05-04,5,很好，建议你们去下载。😃😃
OPPO,2021-05-04,1,登录不上去我就给他卸载了
OPPO,2021-05-03,5,这个软件比其他平台要优惠很多
OPPO,2021-05-03,1,8点可以一元抢手机。无论怎么你也抢不上。
OPPO,2021-05-03,1,什么垃圾软件？一星也不想给。
OPPO,2021-05-03,1,不好，一点都不好什么玩意儿？
OPPO,2021-05-03,1,不发货还联系不到卖家    真垃圾
OPPO,2021-05-03,1,什么玩意儿一点儿也不好用。
OPPO,2021-05-03,1,垃圾一颗星也不想给
OPPO,2021-05-03,3,还可以，新人送10元，但发货太慢了
OPPO,2021-05-03,1,要是能微信支付就好了。
OPPO,2021-05-02,1,差到不想再说，什么破玩意儿？
OPPO,2021-05-02,1,根本就登录不进去
OPPO,2021-05-02,1,太假的一颗星也不想给，地址这边他舅那边
OPPO,2021-05-02,1,太差了，发货太慢了
OPPO,2021-05-02,1,太差了，气死我了，一直闪退😡😡😡😡🤬🤬🤬🤬🤬🤬🤬🤬🤬
OPPO,2021-05-02,1,啥啊，动不动显示网络竟然崩溃了
OPPO,2021-05-02,5,NB，NB，NB
OPPO,2021-05-02,1,特别特别特别无语
OPPO,2021-05-01,5,建意不要买那些看不了物流信息的商品，骗人的
OPPO,2021-05-01,5,挺好用的里面的东西物美价廉
OPPO,2021-05-01,5,这软件好是好，有各别人，款付完了不给发货，钱先付了，不发货就不好了，本人收不到货，先问明白在付款了，不然白搭钱吗/先看看在说，先给五颗星。
OPPO,2021-05-01,1,下载五秒后我就给删了，我是真的气死了，真的一颗星都不想给。
OPPO,2021-05-01,1,差评！！！一点都不好用，不能微信支付，东西还超级贵!要是可以用微信支付，东西便宜一点就好了
OPPO,2021-05-01,1,不好，发货慢死了
OPPO,2021-05-01,2,为什么不能使微信
OPPO,2021-05-01,1,我刚下载完一分钟就删了，真的是太差了，我刚进去就一秒闪退
OPPO,2021-05-01,1,垃圾，哈哈哈哈
OPPO,2021-05-01,1,8点的时候我抢手机，给我出现个活动太火爆，又不给我抢。真是一星都不想给
OPPO,2021-05-01,1,什么垃圾，验证码收不到，登录都登不到
OPPO,2021-04-30,5,手机免费0元还有
OPPO,2021-04-30,5,好多啦很好 很好 很好
OPPO,2021-04-30,1,垃圾软件，根本就没有1元的冰箱之类的东西，货也不便宜，即使有便宜的，运费高的吓人，那里见过100多的运费，一星都不想给
OPPO,2021-04-30,1,怎么被限制登录了怎么搞都进不去无语了别人说蛮好用的我去试了一下没想到是这样的无语=_=
OPPO,2021-04-30,1,那小鸡根本就是假的
OPPO,2021-04-30,2,客服态度不太行啊
OPPO,2021-04-29,1,呵呵 一颗星都给多余了
OPPO,2021-04-29,5,怎么说呢，还好啦。但是就求求你能不能让那些店家客服啊稍稍的理一下人。不要一条信息发过去半小时了。机器客服都不回复，一直显示未读诶。好烦呐那样
OPPO,2021-04-29,1,差，差，差，不好用
OPPO,2021-04-29,1,假的，那个小鸡送好礼根本兑换不了商品，好不容易攒齐的鸡蛋兑换不了。
OPPO,2021-04-28,1,因为有个人说拼多多是骗子
OPPO,2021-04-28,1,喂小鸡兑换电水壶也不给  简直就是骗人的  找客服也不处理
OPPO,2021-04-28,1,不好，不值得大家购买
OPPO,2021-04-28,3,我已经在上面买了上百块的东西了，但是货一个都没到，因为也就两三天可以理解，看了看评论区有点后怕，而且这个版本物流确实查看不了，因为红包好坑啊，不能在淘宝直接使用，你早说啊，还有我两个软件两边下。
OPPO,2021-04-28,1,全是假货，骗人的，千万不要买东西
OPPO,2021-04-28,1,垃圾软件，根本就没有1元的冰箱之类的东西，货也不便宜，即使有便宜的，运费高的吓人，那里见过100多的运费，一星都不给
OPPO,2021-04-27,1,非常差，不好用
OPPO,2021-04-27,3,一般般吧，里面的东西是很实惠便宜，但是这发货太慢了，在别处买不到半天就发货了，在这买，等了3天还不发货，好不容易发货了，就卡到了一个地方不动了，心累，不过里面的东西是真的好
OPPO,2021-04-27,1,你可够让你一元抢购手机，平板，然后一直没到就是显示你跟我们发货了，你购买成功，然后你没有收到。货物流程你也看无法观看，你怎么说？
OPPO,2021-04-27,1,烦死了，垃圾软件
OPPO,2021-04-27,1,就是个骗子，坑人
OPPO,2021-04-26,1,真的，垃圾软件，货到了也不给发信息，上面说好用的都是水军吧，给了多少钱？我也干
OPPO,2021-04-26,5,还可以一元钱都不要
OPPO,2021-04-26,4,买的东西看不到返现记录，有些没有返现，还是  海琢优惠  比较方便
OPPO,2021-04-26,2,商家3天都不发货，官方也不管理
OPPO,2021-04-25,1,一点儿边不好用
OPPO,2021-04-25,1,不好用，不能微信支付，那那些没有支付宝没有银行卡的人怎么办？真的是一颗星都不想给？
OPPO,2021-04-25,5,我想要面条机一元一个吗
OPPO,2021-04-25,5,不错的购物软件
OPPO,2021-04-25,1,大多都是骗人的商家，淘宝客服根本不理，助纣为虐。一元抢购好多商家都虚假发货，故意发错货，不发货，查询不到物流信息，商家关店跑人等等…太失望了，淘宝客服向着骗人商家，要不是背后有淘宝，早就黄了
OPPO,2021-04-24,1,发错货没有人理
OPPO,2021-04-24,1,垃圾，不知道啥时候自己下载了，而且还卸载不掉，流氓软件
OPPO,2021-04-24,3,看到还可以  我也想要
OPPO,2021-04-24,3,买了一个1元的手机，不知道收到后要不要收费
OPPO,2021-04-24,1,真烦我这都没有微信支付   烦一星都不想给
OPPO,2021-04-24,1,我这真不错，想看任何都可以，还能悦，想要的那种！
OPPO,2021-04-24,1,发货太慢了，还以为客服都是真人呢，都是机器回复
OPPO,2021-04-24,1,两天才发货，买了快到七天都还没有到一星都不想给。
OPPO,2021-04-24,1,红包用不了了以前还可以用
OPPO,2021-04-24,1,垃圾……DHC好像飓风
OPPO,2021-04-24,1,我吐了，在里面买了两次耳机每次都是坏的，退货叫我付快递费说到了退我，结果没有，吐了呀，感觉比拼多多还有坑
OPPO,2021-04-24,1,只能用支付宝支付😭😭
OPPO,2021-04-24,1,我的号被盗了到头来我还不能把我的号给拿回来
OPPO,2021-04-24,1,就晚了几分钟就抢完了没有数量限制
OPPO,2021-04-24,3,还行吧，只是发货有点慢
OPPO,2021-04-24,1,1元购东西不保证发货，发货还会是虚假发货，弄个资格还这么麻烦òᆺó，不想搞就别搞
OPPO,2021-04-23,5,特别好用！一块钱哟。
OPPO,2021-04-23,1,特别差，不好，不推荐 ，没成功
OPPO,2021-04-23,1,差评，一点也不好
OPPO,2021-04-23,1,里面的东西不好，好友助理都助不让
OPPO,2021-04-22,1,不好，，，，，，，
OPPO,2021-04-22,1,广告假的千万别信
OPPO,2021-04-22,1,真的可以领手机吗
OPPO,2021-04-22,1,什么玩意，以为我们没智商？下载让买一个五块以上送券，券都在原价上加上券价格，赶紧退APP
OPPO,2021-04-21,1,这个软件太烦人了。每次打开其它软件它都会自提动下载
OPPO,2021-04-21,5,这里面东西非常不错，在我眼里，拼多多就是骗人的，拼多多明明标价5.9，点到里面就30.9，坚决抵制拼多多，哈哈哈哈哈哈，那些给差评的，都是拼多多的拖
OPPO,2021-04-21,1,垃圾软件，还不给退货的，差评，差评差评……千万别下载，坑人的软件，小心被坑了，还不给物流看的。
OPPO,2021-04-21,1,一颗星也不想给
OPPO,2021-04-21,3,特价淘宝到点就打不开，上面的提款机到点提款的时它就点不动了全面都打不开定单也没法看现在还没法看↘点不开了金
OPPO,2021-04-21,1,这个差到爆了，千万别别下
OPPO,2021-04-21,1,垃圾，就这服务，让换拖拖拉拉半个月，申请退款，直接拒绝，明明上班时间，却说下班了，眼睛瞎了，这个软件没保障，别下载了。
OPPO,2021-04-20,1,全是垃圾，里面没有好东西
OPPO,2021-04-20,1,根据抽中一元oppo手机下载，结果没看见手机在哪？？？骗子
OPPO,2021-04-20,1,真的垃圾没用。
OPPO,2021-04-19,1,体验感很差，非常不好
OPPO,2021-04-19,1,真是无语了，买了东西长时间不发货，投诉了之后给发货了也不知道发给谁了，也没有客服，真是垃圾
OPPO,2021-04-19,1,垃圾，自动下载
OPPO,2021-04-19,1,东西太水，白送，我都不要……
OPPO,2021-04-19,1,千万别下，别买，我买东西的收货地址是跟拼多多得收货地址是一样的，拼多多就没有给我送错过，即便送错了，第二天也是大早起来就给我重新派送，这个特价版的不一样，送错了不说，第二天立马派送啊，我都等到中午了，还没派送，体验感真的差的不行，垃圾软件
OPPO,2021-04-18,1,千万别下假的气的我都想把手机....不说了
OPPO,2021-04-18,5,一元就能买平板很好！
OPPO,2021-04-18,3,0.9买了一个平板会发货吗
OPPO,2021-04-18,5,非常好，非常好，非常好，非常好。
OPPO,2021-04-18,1,垃圾真尴尬不上课
OPPO,2021-04-18,1,非常非常差，里面的东西比拼多多上买的还要贵，而且买家的评论也看不到，垃圾货，千万不要被骗了
OPPO,2021-04-18,5,打开天窗完美。，
OPPO,2021-04-18,1,买了不发货，哎就是玩儿
OPPO,2021-04-18,1,垃圾，买的没发货为啥不给退，还未发货秒退，什么意思垃圾
OPPO,2021-04-18,5,非常的好用 很实惠
OPPO,2021-04-18,1,买都买不了，垃圾软件，还没拼多多好
OPPO,2021-04-18,1,假的，一点都不好，千万不要被骗了
OPPO,2021-04-18,1,垃圾，假的不能再假
OPPO,2021-04-18,1,是真的还是假的
OPPO,2021-04-17,1,差，不能微信支付
OPPO,2021-04-17,1,还行送10元红包卷，但是买东西后迟迟不发货。
OPPO,2021-04-17,1,我玩个游戏你就给我弹出来这个然后全部都团灭
OPPO,2021-04-17,1,根本收不到短信，叫我怎么拿快递，我给差评
OPPO,2021-04-17,2,不能，微信支付……
OPPO,2021-04-17,1,根本就看不到发货
