Src,Time,Rank,Val
OPPO,2021-06-18,1,我也不知道身份证怎么还能被别人注册，你的身份识别系统是干什么吃的？电话电话被人注册，身份身份被人注册，人脸识别到底怎么过的？
OPPO,2021-06-18,1,我也不知道身份证怎么还能被别人注册，你的身份识别系统是干什么吃的？电话电话被人注册，身份身份被人注册，人脸识别到底怎么过的？
OPPO,2021-06-18,1,铁路会员交易密码忘了怎么整
OPPO,2021-06-15,1,用户名格式错误试了几次都是注册也注册不了
OPPO,2021-06-14,1,我从来没见过这么坑的官方APP🌚明明填的身份证手机号都是对的，非要说错了，有毛病？？？
OPPO,2021-06-14,1,一毛钱，我自己手机能不能用我不知道?
OPPO,2021-06-12,1,根本没有注册过就显示账号存在，找回密码还身份证与电话不符，用户名试八次也校验失败，我真服了
OPPO,2021-06-12,5,注意这个不能退票
OPPO,2021-06-12,1,显示出票失败，重新订票说我有待支付订单，点开一看又是叫我重新下订单，然后依然说我有待支付……大无语
OPPO,2021-06-12,1,说实话挺感谢平台提供的服务，就是不更新不让别人使用这项处理的不是很好，要求更新没意见，就是你们需要更新版本的时候，能不能提前通知一下用户，大部分人基本耐心在需要购票的时候去等更新，个人建议给用户发短信说需要更新版本
OPPO,2021-06-11,1,明明显示余票充足，但是拍了两次队都说出票失败，以前春运高峰都不需要排队，这次不是春运竟然要排队，排完还没票，人工客服态度也不好，说不负责，气的去携程买就买到了，真无语。
OPPO,2021-06-11,1,我的号码改了密码记不得了，却不好改
OPPO,2021-06-11,1,垃圾软件，有人暗箱操作
OPPO,2021-06-10,1,连后台都开不起，一离开就要重新进
OPPO,2021-06-10,1,为什么一会有那趟车，第二次就再也搜不出来
OPPO,2021-06-09,1,确认车票后提交缓慢，每次都不成功
OPPO,2021-06-09,3,这款软件还行 就是不能接续换乘 举个例子 比如说坐火车 如果需要中途转站的话 他这个还显示不了 买票 只能从始发站选择到中转站 然后再从中转站再买到终点站 有一点麻烦
OPPO,2021-06-08,1,一加8T登了半天登不上，小米6一下就可以，怎么做的软件适配。。。
OPPO,2021-06-07,1,明明显示有车票 ，点进去却说是没车票了 ，我还特地退出来 ，点进去还是显示有车票 ，还有候补人数 ，你能明确一下人数吗，人要是特别多的话，我就改签了 。
OPPO,2021-06-06,1,离谱，明明没注册非显示注册。半个小时搭进去大无语事件
OPPO,2021-06-06,2,无语了 上传了几十遍身份证的信息一直不通过 太垃圾了吧
OPPO,2021-06-06,1,我着急回家看病，就没法订票呗
OPPO,2021-06-05,1,"从来没这么无语过，明明没有注册过，这边显示已经被注册了，退出去登录，密码有错误，忘记密码却说没有用户存在，简直无语!!!!!
垃圾软件!!!!!!"
OPPO,2021-06-04,1,差评吧 人脸识别一直未通过试了十几次
OPPO,2021-06-04,1,那个用户名直接搞不了，一直按照要求用的，还是不行
OPPO,2021-06-04,1,经常卡退，太差了！整天喊调运行图，你倒是调个锤子！运行图调整的把我回家的车调没了！
OPPO,2021-06-03,1,什么垃圾软件，登进不去
OPPO,2021-06-01,1,定个票，整了半个小时，未支付不能取消，刷新也不出来，退了票状态不更新，买票又提示存在未处理订单，这次真的是服了，已卸载！
OPPO,2021-05-31,5,很好啊，怎么有那么多人喷呢，方便准确，也不会收那么多额外费用，都是隔壁找来喷的吧
OPPO,2021-05-31,1,怎么登录不了！
OPPO,2021-05-30,1,垃圾就是垃圾。
OPPO,2021-05-28,5,好用，非常的好用，而且也能扫码进站
OPPO,2021-05-25,1,登陆不上？单机版？
OPPO,2021-05-25,1,我自己的手机号我自己的身份证号不能注册啥意思？我也没犯法也没借给别人
OPPO,2021-05-25,1,无法登陆。。。
OPPO,2021-05-24,1,软件非常好用，我非常喜欢，强烈推荐，打5星，分期给。
OPPO,2021-05-18,1,垃圾软件，怎么登都进不去
OPPO,2021-05-15,1,说实话，一星都不想给。
OPPO,2021-05-15,1,很垃圾的软件一星都不想给，客服还拼命的推卸责任。
OPPO,2021-05-14,1,以前绑的手机号不用了，还解不了绑，别问，问就是输入手机号或身份证号错误
OPPO,2021-05-13,1,。。。。。太差了，太差了。
OPPO,2021-05-13,1,差到一颗星都不想给，我要登录进去了，我明明把那个身份证号码和手机号码输对了，我一按那个发送验证码，就提示我“你的号码输错误”，我还以为是我自己搞错了，我就重新试了几次，没想到还是那个鬼样子，烦都烦死了。
OPPO,2021-05-13,1,一星也不想给，太黑了，恶心，就是个黑钱软件
OPPO,2021-05-11,1,真的不好用，还不如就在微信上买😅
OPPO,2021-05-10,5,怎么回事啊现在，都登录不了啊呜呜呜呜
OPPO,2021-05-09,1,下载下来，完全找不到软件在哪里。想再次查看票压根找不到。
OPPO,2021-05-09,1,我真的一颗星也不想给，今天母亲节想早点回去给妈妈一个惊喜买的十点钟的票，提前五六分钟到了一直等没等到列车，然后车就已经到了目的地，我还在出发地一脸懵逼，我又要等那么久。真的太差了太差了，明明上不去的车为什么还要开售票窗口呢？
OPPO,2021-05-07,1,的确一个垃圾软件，一星都嫌多
OPPO,2021-05-07,1,垃圾，想要挣钱也不用这样啊，没有候补到票还不退钱，推卸责任，不承认没退钱
OPPO,2021-05-07,1,垃圾软件，注册了登陆还显示没注册，去注册又显示已注册，垃圾
OPPO,2021-05-06,1,"下载下来，登陆不了，好难受啊。

是手机原因，还是app原因呢"
OPPO,2021-05-06,1,真无语。登不进去。重新注册吧，又说注册过了。去密码登录又说密码错误，用户名不存在。什么鬼东西无语死
OPPO,2021-05-06,1,垃圾软件登录不上去，气死人
OPPO,2021-05-05,1,没得说 ，真的好用
OPPO,2021-05-05,1,无语了 每次晚点都还说是正点人还在火车站呢你车就开出去了 做不到时间准点晚个10来分钟都不说什么每次都晚半小时你还设置那个时间干嘛 直接改掉时间不好吗
OPPO,2021-05-04,1,你倒是给我补到啊，从第一天补到现在，都没补到，明天该怎么回学校。。。
OPPO,2021-05-04,2,用户名无法更改，而且不能保证后台运行
OPPO,2021-05-04,1,咋回事放票还非得等前一天晚上放，好家伙！
OPPO,2021-05-03,1,不能登录啊，8pro现在的系统是不兼容吧，用老的5t就可以登录的，啥玩意儿
OPPO,2021-05-03,1,什么玩意儿，明明全程的有票，中间的短程凭什么不放票，我们就只配等着吗（越想越气再减一星）
OPPO,2021-05-02,1,我无语了。没票就是没票，你还非要放一个有票几张完了激动的点一张，然后就没了，就可无语，你知道吗？搞人心态。麻烦用手做一下软件。真无语了。真的是一星都不想给。
OPPO,2021-05-02,2,限制永远只是在恶心普通用户
OPPO,2021-05-02,5,这个是官方的软件
OPPO,2021-05-01,2,人一多就崩溃，登不进去
OPPO,2021-05-01,1,压根买不到票 醉了
OPPO,2021-04-30,1,什么垃圾软件，我买了候补票退票了，一分钱都没退给我，你们吃国家粮的还缺这点钱吗？
OPPO,2021-04-30,1,无法都登录啊！！！
OPPO,2021-04-30,1,我真的是无语了，一操作多了，就显示操作过快，我要你何用啊？售票一秒没，然后到日期了，就开始随便放票，你玩呢
OPPO,2021-04-30,1,服了，买的票一个也不见了，270没了，服了到是给我退啊
OPPO,2021-04-30,1,为什么一直网络异常?
OPPO,2021-04-30,1,最垃圾的软件，没有之一
OPPO,2021-04-30,1,从17号就开始候补，到现在一直候补不上，我也是服了
OPPO,2021-04-30,1,什么东西啊？我买了候补票然后想退票，退了之后没把钱退给我，真烦，一星都不想给
OPPO,2021-04-30,1,一星都不想给，为什么候补不到票
OPPO,2021-04-30,1,0分，候补规则双人的在前，出单票了直接跳过？？？？？这是什么规则
OPPO,2021-04-30,1,垃圾一生黑=……
OPPO,2021-04-30,1,这个软件是真的真的非常厉害！
OPPO,2021-04-30,1,垃圾，客服没用
OPPO,2021-04-30,3,我觉得还是挺不错的  然后也没那些广告啥的 候补 一般都是能候补得到 所以今天还能候补上嘛 但是有一说一的建议 如果没有票了就不要显示候补 直接无 让我们早点死心也好 不然一直期待着 然后希望越大 失望越大
OPPO,2021-04-29,1,能不能别这么恶心人
OPPO,2021-04-29,3,只能说以前用的很好 今年不知道是不是更新的原因 一点都不好用了 登入异常 看着看着账号掉线 我也是醉了
OPPO,2021-04-29,1,一分不想给，每次都是网络异常。
OPPO,2021-04-29,5,很好用。给力，客服。
OPPO,2021-04-29,1,只能说垃圾透顶，根本就不能注册，一直叫你发信息给12306获取验证码，一次又一次，真是无语，虽说是一毛钱一条信息，但是真的是注册不起，无论多少条都注册不了，建议换其他的相似软件，真垃圾垃圾垃圾
OPPO,2021-04-29,2,啥也不是，候补太差劲
OPPO,2021-04-29,1,从开始预售那天候补到车快要开走了还是候补不到，这功能有个毛用。
OPPO,2021-04-29,1,"下载下来，登陆不了，好难受啊。

是手机原因，还是app原因呢"
OPPO,2021-04-29,1,17点开售，1秒就没了？玩呢？区间限售？那你中间站干脆别开了，铲了种树算了，让我们干看着着急？
OPPO,2021-04-28,3,登录过后，才几个小时不进这软件就直接显示未登录
OPPO,2021-04-28,1,注册个用户名半天弄不好，从来没用过这种垃圾软件
OPPO,2021-04-28,1,垃圾软件，抢不到票，还不显示候补人数！
OPPO,2021-04-27,1,垃圾官方软件，每次票开售就没了
OPPO,2021-04-27,1,不停的刷登录界面，还返回不了，真的服气
OPPO,2021-04-27,1,一直抢不到票 口口声声说百分百抢到 但是到现在十天了也没有抢到 真的心碎
OPPO,2021-04-26,5,真好用不错卖票也快
OPPO,2021-04-26,1,打不开，体验感很差
OPPO,2021-04-26,1,我真的什么都不想说，人脸识别半天识别不了，指纹登录也开启不了，不要说我手机有问题，我手机买的，就是开启不了，还一直加载
OPPO,2021-04-26,1,太垃圾了，抢不到票，而且还不给退钱
OPPO,2021-04-26,1,登陆不了，一直显示加载中…要你何用？
OPPO,2021-04-25,3,下次更新的时候加一程中午的，就是北海到防城港北的动车票，加一程中午的就好了
OPPO,2021-04-25,1,既然你们设定时间长了账号登录失效，就像其他软件那样做一个定期重新登录的提醒不？好？吗？非要用“访问环境异常”来概括这个问题，耽误了好几天买票的时间，重新下载才恢复正常。抢不到票是我的原因，但是软件不让我购票，不怪我发这条差评。
OPPO,2021-04-25,5,那些登不上去的人，你们去用垃圾的第三方软件加钱购票啊，用什么神器12306😌，自己手机差，网速不好，登不上去，赖人家软件什么事，我都在这上面买了好几年的票了，都不会有你们讲的这么多问题。就没见过这么离谱的人自己手机号被人注册了，自己注册不了都要来给软件打差评的人。
OPPO,2021-04-25,1,注册太慢，时灵时不灵
OPPO,2021-04-25,1,不行，我的移动卡早就被别人注册过了。我自己根本就注册不了。
OPPO,2021-04-25,1,真是无语，我的密码都没变过，打开一次就要重新登陆，一登录就说我密码错误，每次我都要重设密码，搞笑的是我每次重设的都一样。他就说我密码错误
OPPO,2021-04-25,1,垃圾软件，一星都不想给
OPPO,2021-04-25,1,真的垃圾，根本就登陆不上去，苹果设备才能登上去，人上人？也不更新，也不解决漏洞，等谁呢？
OPPO,2021-04-24,1,注册不了，然后换其他方法注册，过来登陆总行了吧，然后还登陆上，然后买票还只能在这上面买，既然经常出毛病，还凭什么只能在这上面买
OPPO,2021-04-24,2,图标不显示桌面上，老是要去软件商店打开，太麻烦了
OPPO,2021-04-24,1,一点儿也不好 。。。。。
OPPO,2021-04-23,1,我的手机号被别人注册了，我自己就怎么也办理不了
OPPO,2021-04-23,1,太难登录了，登了几次登不上。
OPPO,2021-04-23,3,客户端有误怎么办，赶紧修修吧
OPPO,2021-04-23,1,客户端证书有误？啥时候能解决，软件都登不上去，买的票完全没法查询。
OPPO,2021-04-23,1,不给退群就算了，态度还不好，亏得之前我还给同学安利这软件，别人说这软件垃圾，我还解释，结果这次真让我看清了，钱不退也就算了，打电话态度还不好，真是笑死了，骗学生的钱你也心安，我看这好评说不定都是你们自己员工吧，呵呵🙂
OPPO,2021-04-23,1,太差了，注册不了密码找回不了重新注销也登录不了，什么破软件
OPPO,2021-04-22,1,客户端证书有误，无法登陆
OPPO,2021-04-22,1,软件真的够了。
OPPO,2021-04-22,5,呜呜呜，老是抢票抢不过别人，希望我给五星可以让我抢到票
OPPO,2021-04-22,3,登不上，一直是时间错误
OPPO,2021-04-22,1,什么啊，一直显示时间，我想退票都不行啊，我的登不上啊。好无语
OPPO,2021-04-22,3,登录一直显示加载中？？？是什么情况！！！
OPPO,2021-04-22,5,给五星是因为国家动车让我回家方便了，不是因为软件多好用
OPPO,2021-04-22,2,系统证书有问题，无法使用
OPPO,2021-04-22,1,一星都不想给 信息都是我自己的 说我身份证号码已注册(第一次用这个软件) 改个密码说我人脸与身份证号码不匹配(信息都是我自己的) 一星都不想给！！！废物软件卡死了
OPPO,2021-04-22,1,崩了！！…！…！！
OPPO,2021-04-22,1,不管是用移动网络还是wifi，根本登录不了，差评，必须差评
OPPO,2021-04-22,1,9:00开始卖票，刚点开就卖没了，这速度都这么快了，坐火箭买的吗，，，，，
OPPO,2021-04-21,1,太差了，卡的要命，刷脸验证刷了半天还不出来
OPPO,2021-04-21,1,我也是无语了，明明别的日期都有车次偏偏我买的那天没有车次，明明以前还能看到这会就三个了让我选个啥，还怎么都刷不出来我连选都不能选
OPPO,2021-04-21,1,垃圾！！！！！
OPPO,2021-04-21,1,进不去啊，网络异常？我明明网很好
OPPO,2021-04-21,1,一打开就重新登陆，设置了指纹登录就是不行
OPPO,2021-04-21,1,好歹是个官方软件，解决一下问题吧，拿着国家的工资吃白饭吗
OPPO,2021-04-21,2,客户端错误错误，打不开
OPPO,2021-04-21,1,都网络异常了，
OPPO,2021-04-21,1,17点开售，1秒就没了？玩呢？
OPPO,2021-04-21,1,一到抢票就没有 一到抢票平台就卡 候补这个功能是很鸡肋
OPPO,2021-04-21,1,登录都进不去！建议下架
OPPO,2021-04-21,1,15: 00放票，一分钟不到，没了，开玩笑呢？
OPPO,2021-04-21,1,关键时刻掉链子，给我崩了！
OPPO,2021-04-21,1,这么卡，关键时候掉链子的app怎么敢来服务全国人民？淘宝双11都没这么卡
OPPO,2021-04-21,1,为什么13点放票，12点59就没了？系统还一直繁忙。显示有票，买的时候又没了，退出去又有了，无语死了
OPPO,2021-04-21,1,真的恶心人，死活进不去
OPPO,2021-04-21,1,垃圾软件 订成功了两次的酒店 最后都打电话过来说没房让订别的房
OPPO,2021-04-21,1,一买票就打不开软件！真是够了
OPPO,2021-04-21,1,买不了票，一直提示证书客户端有问题检查手机时间设置，我的手机时间是正常的，这是什么情况
OPPO,2021-04-21,1,最垃圾的软件，没有之一
OPPO,2021-04-20,1,显示有票排了半天没有，越更新越拉圾，建议软件更新人员全辞职吧，成天浪费国家的资源
OPPO,2021-04-20,1,不得不说真垃圾 其实半星都不想给 各种注册 登录都有很多问题 麻烦死人
OPPO,2021-04-20,1,客户端证书有问题？？？
OPPO,2021-04-20,1,最新版本的简直让人无语，你完善不了也不用直接把原来的给停了吧，搞得现在都登录不了
OPPO,2021-04-20,1,上次核验不通过这次直接出错服了
OPPO,2021-04-20,2,今天登录就是一直登不上去 是系统崩了 现在连买票的信息也看不了 就是因为一直登录不上去 为什么App运营商都不出来解决这个问题呢 一直也是客户端有误真的就无语 以后都不想用了
OPPO,2021-04-20,4,为什么一直显示证书有问题 啥也干不了呢
OPPO,2021-04-20,2,所以账号怎么看呢，希望加个账号保存系统先给两星
OPPO,2021-04-20,1,一直查询不到车次信息
OPPO,2021-04-20,1,根本登不进去，最新版本
OPPO,2021-04-20,1,还手机双向认证，但凡你能顺顺利利发送一次验证码过来我也不会特意上应用中心来打一星！！！！！永远也是说运营商的问题！！！！
OPPO,2021-04-20,1,真的无语，付款一直付不了
OPPO,2021-04-20,1,一直用不了，烦烦烦
OPPO,2021-04-20,1,注册不了，登录不了，忘记密码更改不了。反正就是什么都干不了
OPPO,2021-04-20,1,垃圾还官网 根本进不去 总是证书错误 我也醉了 害我浪费了一张票
OPPO,2021-04-20,1,无法登登录，一直打转，最新版本！
OPPO,2021-04-19,1,根本登不进去，也不知道是什么原因
OPPO,2021-04-19,1,体验感极差写着有票点进去又没有退出来又有
OPPO,2021-04-19,1,烦死了登录找回密码真的很费事啊，，，从没用过买票，偶尔需要用一次还真难搞
OPPO,2021-04-19,1,无语了，别人竟然把我手机号码注册了，我这边还改不了
OPPO,2021-04-19,5,给个好评，反正我只是建议能不能把候补票放出来，搞得我们都在等票。。。。还没有拿到票，好假啊………希望给个建议，短距离无座都行，拜托了
OPPO,2021-04-19,1,就很烦，明明是官方软件，搞得像盗版的一样，网络动不动就崩，我五一回不了家就是你原因
OPPO,2021-04-19,1,4月19日早上，系统进不去了，提示：[很抱歉，查询失败，您可以稍后点击下面按钮重试，点击重试，客户端证书有误，请检查手机的时间设置是否准确。（3）]。
OPPO,2021-04-18,1,为什么查不了票了？
OPPO,2021-04-18,1,真的很烦，莫名其妙，我同学的可以买票很顺畅，我的不是环境异常，就是什么时间设置错误，有毛病不能修复吗？？？？
OPPO,2021-04-18,1,为什么差评那么多，官方能找找原因吗
OPPO,2021-04-18,4,不连WiFi为什么一直显示客户端证书有误，手机设置了WiFi和数据都可以用，但是没有WiFi什么都加载不出来。
OPPO,2021-04-18,1,这又是证书问题和人脸认证，人脸认证是咋都认证不起，证书问题是票也买不到，你这是要玩完了吗？经常出问题，怎么搞！
OPPO,2021-04-18,1,啥玩意？一个验证码发了二十多遍还是注册不了？这软件还能用嘛？
OPPO,2021-04-18,1,这么大个APP，出了bug这么久不修复，程序员再吃干饭吗
OPPO,2021-04-18,1,看到评论我就放心了
OPPO,2021-04-18,1,一直打不开，说什么客户端证书有误。
OPPO,2021-04-18,1,买了票，查不到老说时间设置错误，我真是服了，也太垃圾了
OPPO,2021-04-18,2,密码一直搞不对，重置直接复制默认密码都登不上，无语至极
OPPO,2021-04-17,1,查车票根本查不到，更新消息很慢
OPPO,2021-04-17,1,太垃圾了，一直显示网络不能用
OPPO,2021-04-17,1,怎么？不行骂你了？怎么官方app就这么搞？智能手机普及了好吗？干点人能操作的系统好吗？请个好点的工程师，别混吃等死了好吗？
OPPO,2021-04-17,1,真是无语了，发短信就发了20来条了，还没注册上，无语了
OPPO,2021-04-17,1,真是垃圾，发不出来都不测试的么？
OPPO,2021-04-17,1,又崩溃了，说我的手机时间设置错误！自己从来不承认是自己的研发团队垃圾
OPPO,2021-04-17,1,无语，登不进去还得卸载重装，从来抢不到票，从来不需要回家。。。。
OPPO,2021-04-17,1,真是好东西，垃圾，一直不给通过，一直系统繁忙
OPPO,2021-04-17,2,都不更新修复bug，还官方
OPPO,2021-04-17,1,恶心玩意，买票付了钱不给票
OPPO,2021-04-17,1,什么玩意儿？系统崩成什么样了？显示有票买不到，无语了
OPPO,2021-04-17,1,什么垃圾应用，动不动退出，怎么抢票，开发这软件的人脑壳里都是浆糊！
OPPO,2021-04-17,1,核验什么的也不发，恶心死了
OPPO,2021-04-17,1,一星都不想给，懂得都懂。人脸是横的，根本通不过。放票时间到了第一时间就是候补等待人数中等。我可去你的吧！
OPPO,2021-04-16,1,登录界面时显示“客户端证书有误，请检查手机的设置时间是否准确”，尝试了卸载又重新下载，重启手机，包括设置手机的时间以及开关飞行模式等一系列操作，花费了一天，截止现在问题也没解决，真的让人心情糟糕，送技术人员一个微笑，我谢谢你们。
OPPO,2021-04-16,5,服务器怎么了，
OPPO,2021-04-16,1,从你从来没买上票的，😁我也不知道为啥，明明你才是官方。好了这下又回不到家了。😁😁😁
OPPO,2021-04-16,1,恶心死💩💩💩💩💩💩
OPPO,2021-04-16,1,显示有票排了半天没有，越更新越拉圾，建议软件更新人员全辞职吧，成天浪费国家的资源
OPPO,2021-04-16,1,真垃圾大家不要下载！l
OPPO,2021-04-16,1,一来评论区看来我的手机么没问题呀果不其然大家都有同样的问题呀
OPPO,2021-04-16,5,速度一流，你真棒！👍👍👍
OPPO,2021-04-16,1,有大病呵呵呵呵
OPPO,2021-04-16,1,一买票就被卡出来，再登就死活进不去。真让人寒心，看着挺好看，一用就废柴
OPPO,2021-04-16,1,好垃圾，注册都没反应
OPPO,2021-04-16,1,腊级 给我气死
OPPO,2021-04-16,1,每次抢提示没登录！
OPPO,2021-04-16,1,什么阴间系统，显示余票充足付钱了又说没有票，玩呢
OPPO,2021-04-16,1,改名叫废物12306好了
OPPO,2021-04-16,1,无语，系统一直卡，点进去，根本不能显示乘车人，之前乘车的时候，查看车票一直点不进，太糟心了
OPPO,2021-04-15,1,根本注册不上  一直显示注册名已经存在 真吐了
OPPO,2021-04-15,4,什么叫客服端证书有问题，请检查手机时间设置，
OPPO,2021-04-15,1,简直就无语，，，，
OPPO,2021-04-15,1,体验感好差，系统显示客户端证书有误，然后就查不了票，更别说买票了，为什么官网还这么垃圾呢？无语=_=
OPPO,2021-04-14,1,真垃圾 一星都不想给 什么客户端时间有问题 着急看什么时候到站
OPPO,2021-04-14,1,差！！体验感极差！！！
OPPO,2021-04-14,1,垃圾软件  滚   一星都不想给
OPPO,2021-04-14,1,我的手机号我的手机，注册注册不了，啥啥不行(▼皿▼#)
OPPO,2021-04-14,1,一星都多……莫名其妙就进不去了，客户端证书有误是什么意思，我手机时间没问题，卸载了重新安装还是证书有误，评论好多都是这么回事，这么多手机不适配就不能不上吗？非得更新？用户体验太差，极差！！！！！！！中午知道评论为什么都是差评了，好评都是刷的吧
OPPO,2021-04-14,1,一分都嫌多 账号密码忘记了准备找回 都不能找回 人脸识别 短信验证都不行 还说什么客户端有问题 真的是太差了 一分都多
OPPO,2021-04-13,1,密码忘了，三种方式找回密码，一点用也没有，手机号，身份证号都对还一直说有错误，多少遍都不行，一星也不想给
OPPO,2021-04-13,1,垃圾  一星都不想给
OPPO,2021-04-12,1,一加8T打不开…其他手机没问题…
OPPO,2021-04-12,1,客户端证书有误怎么解决？？？
OPPO,2021-04-11,1,不好用，一星都不想给
OPPO,2021-04-11,1,一星都给多，别人盗用我的手机号连验证码都不用发，自己找回手机号就要各种验证各种密码，这个软件是为谁服务的呀?为盗用手机号的人吗？
OPPO,2021-04-10,1,我想问一下 客户端证书有误 ，请检查手机时间设置是否准确 是什么意思
OPPO,2021-04-10,1,更新之后就查不到历史订单了……12306真的咋越做越难用
OPPO,2021-04-09,1,无法登陆，怎么办！！！
OPPO,2021-04-09,1,注册这么多次都注册不了无语了
OPPO,2021-04-08,1,垃圾，注册不了
OPPO,2021-04-08,1,哈哈，用网络异常，就是不让网上买票呗
OPPO,2021-04-07,1,整不明白软件就别整。。总出错。。啥也不是
OPPO,2021-04-07,1,安装玩了，怎么打不开啊，
OPPO,2021-04-06,1,注册都注册不了
OPPO,2021-04-06,1,我就不明白了，为什么总是需要重新登录，还总是人脸核验
OPPO,2021-04-06,1,为什么登录不了，也注册不了，存在的意义是啥
OPPO,2021-04-05,1,天天让我验证人脸，说我账号异常，我就不明白了，我票都买了到底有啥异常，真奇怪呀
OPPO,2021-04-05,1,一分都多。。。
OPPO,2021-04-05,1,不在座椅那设计插座，反而在洗手台那设置插座，真是智商堪比天才的设计
