Src,Time,Rank,Val
华为,2021-01-08,2,升级了这个版本后，候补订单买到票了，既没手机短信通知，也没支付宝通知，怪哉，分明设置了支付宝通知方式
华为,2021-01-08,1,一直提示我密码错误，改了重登还是提示密码错误！软件是真不好用
华为,2021-01-08,1,"注册需要24小时认证，时间太长了吧，
有这24小时，都够回家多少趟了？"
华为,2021-01-08,1,注册不了，是我不配
华为,2021-01-08,1,买个票你那么多事干嘛?一会儿这一会儿那的，大家都只是想买个票哪里需要你多事
华为,2021-01-08,2,实在忍不住来了，曾经下载过好多次，最早的时候很难用，反应慢之类的就不说了，这次下载不到两分钟就想来吐槽，我登录上了，让成为铁路会员，我成为了，然后点击会员积分让绑定，我输入交易密码，点击绑定，显示绑定成功。。。然而，并没有出现我想看的积分情况，还是原始界面，让输入交易密码，，，，，，我服了，服了，不是，铁路没钱吗？开发的软件这么差吗？究竟是什么原因呢？你们发抖音发各种平台的宣传让用户使用12306购买票，如果好用，你觉得需要你们宣传吗？把宣传费用放在软件开发上我来当自来水好不好！！！！
华为,2021-01-08,1,我真的要服了，一次次说我环境异常，核验了也不行！！！卸载重装还是不行！！换了流量也不行，合着白蹲了
华为,2021-01-08,4,为什么不能选择起点站和终点站
华为,2021-01-08,1,不好用，经常性卡死，点不动，还要排队几分钟
华为,2021-01-08,1,登不上，注册不了，怎么办？不知道怎么搞
华为,2021-01-08,1,心寒了买票退票时间一分钟不到就扣我一百多。是虽然错在我。但是这个退款条例太心寒了。也没有五分钟或3分钟之内退票免手续费。真的是被坑到的感觉。然后还不得不用12306有被霸王条款欺压的感觉。好比如被打了还要说打的好。太失望
华为,2021-01-08,5,今天买的G2918深圳北到北海的票，发现没有检票口字样了，不知怎么回事，请尽快修复，以免影响行程
华为,2021-01-08,1,已经登录，一抢票又叫我重新登录，重新在登录就登不上去了
华为,2021-01-07,1,石家庄疫情期间，火车站都关闭了，怎么到石家庄的火车票还能购买成功？？？就不能改进一下吗？？？？？
华为,2021-01-07,1,可好了，我咋不知道24.5的百分之五是2？
华为,2021-01-07,5,春运抢票到了放票时间，选了日期选了车次看到有票点击进去买票硬是不动没反应，然后我退出再登到了看到有票点击依然不动，我刚开始怀疑我手机是不是坏了，到了选好车次时再点击就没反应了，最后用第三方软件买到了票。
华为,2021-01-07,1,"火大，刚刚已经把这个软件删了，但是想到要评论，我又把它下回来了
     1.为什么注册每次填入验证码后，就要问是不是我本人的电话号码，死都不让我注册，每次都是注册失败
     2.后来我又用我自己的新的一张电话卡，再给他发短信他就不回了，我就搞不懂了，不同的电话号码你为什么不回？
     3.用你们的验证码注册失败，每天又只能给你们发三次，那难道要我等到明天注册？
     4.你们就不能用个先进的注册方法吗？用现在常用的验证码方法不行吗？
     一个大一新生想要回到一千多公里外的家就这么难吗？！"
华为,2021-01-07,1,发售的瞬间永远是在转动刷不出来的，等到刷出来，提交订单的时候它每次都要求选择乘车人？？？就不能自动选择上次的乘车人吗？？每次都要浪费几秒去选乘车人？？
华为,2021-01-07,1,密码一旦忘记用手机号码是找不回来的
华为,2021-01-07,4,我的12306是人脸识别不了，弄了N次了。
华为,2021-01-06,5,莫名其妙的帐号被注销了，再去登陆用户名己存在，不知怎么才能登陆进去
华为,2021-01-06,1,很差劲，登不上，之前还去火车站弄过了，现在还是登不上，反正就是特别麻烦，现在买票都要登12306了，还好微信还可以免登12306（不过要加五块钱），气人。
华为,2021-01-06,1,为什么注册不了？
华为,2021-01-06,1,我都无语了，我就两个手机号，我没有注册过，结果都已经注册了，找回密码找不回，打个客服电话还都是电子音，又摁一，又摁二的，我就想咨询一下问题，都不知道去哪，我只是想线上买个票都买不了。
华为,2021-01-06,1,现在连短信通知的舍不得了吗？情景智能废掉了，一夜回到解放前，12306这个操作真的穷疯了？？？
华为,2021-01-06,1,我想说点哪趟车哪趟车不存在吗？更新也不管用！！！！！！！！！！每次都这样，非让我去第三方买吗
华为,2021-01-06,1,什么玩意，自己的身份证都都不能找回密码，以前用的手机号码注册的，谁还记得。那么多年了，最差劲的一款软件，连找个密码都不行，刷脸都不成功。
华为,2021-01-06,5,不错，有时候在其他软件上没有买到，在12306上成功捡漏抢到余票，就是自己每天勤快一点多来看看就行。而且，官方退票改签什么的都很方便很及时，值得相信的。
华为,2021-01-06,1,卡、点触没反应，这些吃国家饭的不干人事
华为,2021-01-06,1,"然而软件做的并不是很令人满意
欲戴王冠，必承其重
不让其他软件做这门生意，自己也没有给做好🌚"
华为,2021-01-06,1,莫名重启，烦的很
华为,2021-01-06,1,思路是对的，但软件质量比较差，经常出现BUG
华为,2021-01-06,1,我这号码被人盗刷了，没人管的吗
华为,2021-01-05,1,闪退。只能给差评了。用过旧版的，没碰到问题，为什么新版就闪退呢？？？？
华为,2021-01-05,1,快放假了硬是登不上，以为是手机号的原号主注册过，结果问了客服没人注册过。就很迷惑
华为,2021-01-05,1,安卓版本出现点击车次无响应情况。
华为,2021-01-05,1,一个学生资质找了老半天都找不到无语了这什么破页面，百度过了版本不一样？？
华为,2021-01-05,5,有问题请打12306咨询，你们上述问题他们都可以解决 验证码重复可能是因为双卡的手机号，重新注册不了可能是之前在第三方软件上注册过所以导致现在注册不了，用户注册名已存在重新更换用户名就好了。诸如此类请拨打12306
华为,2021-01-05,1,为什么注册时候说已经注册了，登录时候说密码不对，人脸认证是查无信息，最关键的是我的身份证信息对了，电话号码居然不是我的？？？？！！！！我就想问问这个软件是干嘛的？？！！究竟是买票的还是泄露用户信息的！！！还中国铁路，，，，真是服了，，
华为,2021-01-05,1,抱歉，暂时无法操作（6666）
华为,2021-01-05,1,界面卡，注册了还登录不了，
华为,2021-01-05,1,学生票居然是按公布票价（就是原价）来折扣？合着我们学生 你们都想多收钱了？还有卧铺能不能不要总是选上铺ok？还有能不能出个登录设备管理？不然号 被盗了，票给你退了怎么办？
华为,2021-01-04,1,一星好评，蹲点开售的时候秒没票，发车前一两天就有票了，还是充足的票，真棒棒
华为,2021-01-04,3,经常出现买票点击没反应
华为,2021-01-04,1,换了手机号就没法登陆了，12306人工服务也打不通，服务是真差。
华为,2021-01-04,5,咱也不知道为啥那么多差评，反正我用着还挺好，变更到站啥的都挺好的，好评！
华为,2021-01-04,1,有些评论说到点了，泱泱大国，做不好一个订票软件，退三张票，只到了两张票的钱，同时退，你为什么不同时到账呢，到处查都查不到进度，还显示都退款成功，退款成功了，那钱呢，难不成你这么大个铁路局想吃我39元五角？确实吃一个不多，上百个，上千个，也不是一个小数目，找不到客服，什么东西都不是一目了然，要不是一个重要的交通工具，谁坐啊，你请鬼坐去吧，两个字，落后，你铁路局的都是大爷，
华为,2021-01-04,5,华为mate40点用户名后没反映，无法录入指纹，和乘车人
华为,2021-01-04,1,12306是恶心人，登录失败说我异常，短信验证码也发了，邮箱也弄了，人脸核验偏偏就你通不过，玩支付宝人脸支付都能行，就你牛，死活不行，真是高贵，高攀不起
华为,2021-01-04,1,买不了票！点进去显示买不了票，车次不存在！还不是一两次！
华为,2021-01-04,3,无法查询到该车次信息是不是得改改了
华为,2021-01-04,1,真无语，注册一下发了消息等了十几分钟不回复，然后就一直卡着，拜托我着急用呢
华为,2021-01-04,2,我的 界面第一栏姓名点不进去，这bug也太明显了吧
华为,2021-01-04,2,这软件不好用，订票界面要是能提前选择好乘车联系人，抢票的机会会更大的，建议优化一下购票流程，
华为,2021-01-04,1,官方软件还不如普通买票软件，注册一上午注册不上，也是无语了。
华为,2021-01-04,1,更新完以后特别不好用，滑动都没反应
华为,2021-01-03,5,那登录不上的不妨先把《服务条款》和《隐私权政策》看完再试试，上来就是一个差评，毕竟官方软件，吃亏最多的就是你们这些不爱看这些的。
华为,2021-01-03,3,我可以点其他的内容，但是当我买票时，它就是点不出来，没有反映，只有重新下载才有用
华为,2021-01-03,5,声明一下，以免键盘侠说是托，我已经注册一年了，真的挺好用的。👍
华为,2021-01-03,1,"错错错～
验证码总是错～
千错万错还是错～"
华为,2021-01-03,1,打不开软件，哈哈，还是用美国的吧
华为,2021-01-03,1,提示访问环境异常！！！！！
华为,2021-01-03,2,为什么短信通知没了？？？？？？？
华为,2021-01-02,3,今天12306是挂了么？无法登录，报错43002
华为,2021-01-02,5,非常棒，操作快捷，客服态度非常好
华为,2021-01-02,1,我很好奇，我为什么买不到火车票了？全是高铁票了
华为,2021-01-02,1,这软件服了，注册个账号验证码一直发一样的，输入之后还一直说让我看看手机号是不是正确的，不正确我能收到？这辈子没这么无语过。
华为,2021-01-02,1,麻烦官方的软件做的像个样子吧
华为,2021-01-02,1,e卡通界面用不了～
华为,2021-01-02,2,我为什么登录不上去了？？？
华为,2021-01-02,1,什么鬼啊，登录用户名密码正确就提示环境异常，但是相同的网络就可以查票，什么破玩意
华为,2021-01-02,1,新版本“我的“界面，那么明显的bug都不处理就更新了
华为,2021-01-02,1,专门下一个骂，验证码验证了个寂寞，重新验证发一样的，学生票讲中小学生大学生都可以买，到了火车站告诉我只有大学生算学生，服了
华为,2021-01-02,1,想登陆买票，输入无数次密码，就是无法登录，重新设置密码还是一样，到底是什么原因啊？如果有急事真让人抓狂！
华为,2021-01-02,1,为什么不能设置短信通知？  就只能微信支付宝  之前还可以的呀  害得我华为负一屏都没有行程提醒了！很不方便
华为,2021-01-02,3,"刚更新完，""我的""显示界面出了bug，快看看吧，修复一下。"
华为,2021-01-02,5,"……为什么都说这个软件不好用……
和几年前相比，现在这个软件很好用了！"
华为,2021-01-02,5,差评的都是一群小学生吗，什么奇葩理由都有……
华为,2021-01-02,3,昨天更新了新版本，学生资质查不到了，就挺无语
华为,2021-01-01,5,非常好用，我的车票都是在这里买的。官方应用比其他购票软件简洁多了，功能也很强大。
华为,2021-01-01,1,注册时一直让我发消息获取验证码，获取验证码后又说什么确认号码，确认无误后再发消息获取验证码，然后我就一直循环中，让我非常恼火。
华为,2021-01-01,1,能不能弄好点，真是的，怎么登都进不去→_→
华为,2021-01-01,1,一直弹出来要摄像头的权限，真是骚扰。
华为,2021-01-01,1,现在为什么订车票不发短信了？？？为什么需要读取手机存储？一个订票软件需要存储权限做什么？国家口口声声治理滥用权限侵犯隐私的软件，为什么这些国家的软件自身不治理一下
华为,2021-01-01,1,为什么，我点退票说退不了，过一会有显示已退票，退票就退票吧为什么不退我钱，烦死了都没钱去再买票了，这让我怎么回家！！！！！！！都一个星期多了，怎么还不退我钱，真的快烦死了
华为,2021-01-01,1,花里胡哨的密码设置，点都不方便
华为,2021-01-01,1,真的服了，证确密码用户名都登录不了，说错误……呵呵，几年前都是那样子  到现在过了几年还是这样子，连个app都搞不好。
华为,2021-01-01,2,给两星是想让你们知道，真的没用
华为,2021-01-01,1,没躺车都显示没有信息？
华为,2021-01-01,1,注册好了，去登录，登录不上要去核验身份，核验身份要登录，搞什么鬼👻
华为,2021-01-01,5,"可以用，没有差评说的那么不堪。
人脸识别也成功了"
华为,2021-01-01,4,请去掉开屏广告，出行时间紧张每次都有几秒广告很让人厌恶。
华为,2021-01-01,1,我也是服了  退票不退款  也找不到任何投诉的地方 已经好几天了  退款一直不到账
华为,2021-01-01,5,我怎么也下载石了这个软件呢？就是到了打开这页就开不了了，下一步应该么样操作呃给个见意
华为,2021-01-01,1,真是一颗星也不想给，太难用了吧！！！
华为,2021-01-01,1,建议出一个购票之后的路线图
华为,2020-12-31,5,整整10年了，体验一次比一次好。虽然也有不足之处，但相信工程师。加油12306！
华为,2020-12-31,1,为什么新版买不了票，点车次没反应？
华为,2020-12-31,2,更新之后软件打不开，打开以后各种卡界面，啥都点不了。这你更新干嘛！
华为,2020-12-31,1,密码正确，就是登录不进去，烦死了
华为,2020-12-31,3,"这是个假的吧，啥也没有点也点不进去,信息我点都点不进去。然后我让我同学给我传的相同版本的5.2.11呃，铁路12306，界面和这个下载的都不一样气死了都，我还忘了截图。服了"
华为,2020-12-31,2,通知选项里居然取消了短信通知，造成很多手机都没有实时提醒了，适用性瞬间大打折扣，老年人使用更加不方便了
华为,2020-12-31,1,牛了呀 显示有三张票 可就是买不到 关键是 退出去再刷新 还是三张票…
华为,2020-12-31,1,一直说我验证码什么的注册两天了都注册不了 我都吐了
华为,2020-12-31,1,真服这软件了，我和朋友一起坐火车，我这买俩人的票，明明显示余票充足，买的票都隔八百个车厢，取消再买也还一样，还最多取消三次 ，几个意思？一起出去就不能坐一起呗？
华为,2020-12-31,1,体验感极差，注册的时候说我注册过了，登录的时候说我密码错误，找回密码的时候说我手机号和证件号不对，反反复复重新输入和检查了几十遍，两个手机号码都试了，就是不行。很搞人心态。一天的心情都被毁了。
华为,2020-12-31,1,死活登不上去🙃
华为,2020-12-31,2,有车次或余票的列车，那就应该可以订啊！怎么还会显示无法查询该车次？你们就不能做好点吗？
华为,2020-12-31,1,我下载12306就是想来骂一骂，我在微信的同程上，用12306购票的，学生票没给我优惠就算了，我领了一个十元代金券，第二天早上就莫名其妙给我退票了，然后代金券也没有返还，我找客服，我想说它看懂我的问题了吗？答非所问。🙂🙂🙂好了，我在去同城上骂一骂。
华为,2020-12-31,1,又涨价了，年年涨。快坐不起了。
华为,2020-12-31,5,搜索输入1230后，有个骗人的12308竟然排第一。。。
华为,2020-12-31,1,之前下载过，老是让我登陆，又说密码不对，随便怎么验证就是不行。今天重新下载的。一看评论。马不停蹄的又卸载了😭
华为,2020-12-30,2,做一个简单卖票软件不好吗？卖票都没做好，还弄出个会员乱七八糟
华为,2020-12-30,1,不更新票都买不了
华为,2020-12-30,2,登录了一天都登录不上，一直显示访问环境错误，我真的无语了？？？
华为,2020-12-30,5,嗯。。怎么说呢，超出我预期的好，下载之前看到评论大部分都在说各种各样的问题，都计划要拿身份证去火车站注销第三方的号了，但人脸识别通过了，可以注册，又看到评论有人吐槽验证码问题，但我这次没出岔子，就很顺利地成功注册了，不用第三方买的学生票真的太爽了！！
华为,2020-12-30,5,这个接送站服务咋样
华为,2020-12-30,1,注册麻烦，反复，玩我吗？
华为,2020-12-30,1,吃公家饭的果然不一样，找回密码都不行。
华为,2020-12-30,1,不建议大家升级5.2.11版本，新版本过度要求用户隐私数据，原来啥都不需要，查询，购票，退票，改签等正常使用，更新后不允许读取手机存储等功能就不能使用APP
华为,2020-12-30,5,做的比以前流畅，挺好。钱都用到了实处。
华为,2020-12-30,1,真的服了这个软件……
华为,2020-12-30,1,真的混吃等死的一群人在负责这个项目。随便找个it公司搞一个礼拜都比你们强。
华为,2020-12-30,1,我就想知道已经退票成功，为什么还没到账
华为,2020-12-30,1,无限登录，永远都在登录，根本看不了车程。
华为,2020-12-30,1,打开软件，登录，开始抢票，再次登录，票没了，我登录过了，为什么买票要再次登录？
华为,2020-12-29,3,大家有没有遇到这个软件从后台突然蹦出来的？
华为,2020-12-29,3,我购票成功了，但是不给我发短信
华为,2020-12-29,1,账号密码都对，登录的时候硬是说我网络不对，用手机4G和无线都试了，还是不对。就是登不上去。
华为,2020-12-29,1,真就当自己是大爷？什么问题都不处理？
华为,2020-12-29,2,太恶心人了，用不了你让我买啥票 12306官方这么没素质的呢 不能买你也不能在官方平台上商通知一下。真恶心到了。
华为,2020-12-29,1,忘记密码后人脸识别那个页面根本进不去，完全空白的一页啥都没有
华为,2020-12-29,4,为什么点击候补购票页面后始终是空白页面
华为,2020-12-29,5,注册不上的兄弟姐妹们，可能是在第三方软件上订过车票，第三方软件也是在官网上买的票，所以它给你注册了账号。重新注册的话拿身份证去车站注销一下就好了，我就是这么注册上的。建议还是不要用第三方软件，个人感觉泄露身份证号不太好
华为,2020-12-29,1,12点蹲在手机上面买票   一秒钟就变候选了
华为,2020-12-29,3,现在不发短信了吗？我记得以前都是发短信的啊
华为,2020-12-29,2,心累，想登陆还进不去🙄
华为,2020-12-29,1,为什么更新后 只要你小化后几秒 他就强制返回就和中了病毒一样 这还官方？买票 点不进去 算个鬼东西啊
华为,2020-12-28,2,明明选了学生票，也进行资质绑定了，票价根本就没变
华为,2020-12-28,4,为什么在app带“兑”字的车票，付款时没有积分兑换的选项，我的积分已经达到一万多了呀，想知道怎么操作才能用积分换票，
华为,2020-12-28,1,开启面容ID无限登录，账号登录无限循环，现在完全无法正常登录买票，搞得什么鬼玩意？
华为,2020-12-28,1,我注册都能失败，真无语了🙃
华为,2020-12-28,1,12306消息通知选项中无短信通知功能，新版本下架了该功能，不方便。
华为,2020-12-28,1,真的很无语对这个软件 开启了指纹登录 结果一放上去软件就退出 换密码登上去了结果查看订单还是得要指纹验证………能不能改进一下啊
华为,2020-12-28,1,这是什么啊，每次登陆都要发短信，短信不要钱吗？这还是官方的软件，
华为,2020-12-28,1,我刚修改的密码   就登不上去  说我密码错误  然后就一直被锁定
华为,2020-12-28,4,刚刚的这次更新是本App诞生以来一次质的飞跃！充分体现了以人为本。对这次更新点赞！尤其是增加出发站大屏显示真是方便了送站和接站的家属。
华为,2020-12-28,1,这个软件有一个优点，三个缺点，一个优点就是正规的官网软件，三个缺点是即便下铺全空着你也很难买的到，二是转站的车次你是买不到，三是买不到理想的座位，不是靠近厕所门就是过道边，靠窗的不容易买到。
华为,2020-12-28,1,差评必须差评，服了，登陆都登不上去，显示连接超时
华为,2020-12-27,3,为什么搜不到连云港的车站名？
华为,2020-12-27,3,勉勉强强，最烦的就是在这个软件查看，看不了车程，然后还要去其他软件看，而且其他软件的出票方式还是选这个软件
华为,2020-12-27,4,全程票在中途车站上车需要取票吗？
华为,2020-12-27,1,真牛！一点查询就让我登录 ，一登录就是登不上。
华为,2020-12-27,1,跟着他的程序走，然后突然就收不到了，然后就没然后了
华为,2020-12-27,3,这个相比其他几家坑人抢票软件好一点
华为,2020-12-27,3,更新版本后无法登录，根本买不了票啊？！请尽快解决呀
华为,2020-12-27,5,还没用过这是第1次，以后再评论。
华为,2020-12-27,3,和海南的码上办事软件冲突不能更新
华为,2020-12-27,1,差劲老是登不上去，人脸也识别不了，以前手机号也没用了，邮箱改了密码还是不行，
华为,2020-12-27,2,短信验证那里 一整就是重复 还不好使
华为,2020-12-27,1,为什么把购买车票后dd短信通知取消了？？？？
华为,2020-12-27,1,各种问题，各种不能登录，今天可以明天不行，真真是烦的要命
华为,2020-12-27,1,更新以后就不能登录了
华为,2020-12-27,2,有点bug影响使用哎
华为,2020-12-27,5,更新完了后一直登录不上去，是不是系统原因
华为,2020-12-27,1,登陆了又弹回来显示我未登录，重复了N次还是这样，什么玩意儿啊?
华为,2020-12-27,3,人脸识别老是不通过！明明是本人，但是还是核验失败！！！
华为,2020-12-27,2,为什么，我点退票说退不了，过一会有显示已退票，退票就退票吧为什么不退我钱，烦死了都没钱去再买票了，这让我怎么回家！！！！！！！
华为,2020-12-27,1,取消短信接口，手机的负一屏没办法直接显示车票信息。这是赤裸裸的倒退，时代的前进，功能在倒退，给出行增添了很多麻烦。
华为,2020-12-26,5,太棒啦！果然还是官方靠谱，在下面提醒我学生票要提前办理学生资质认证，上次在别的渠道购票就没有通知，差点误了高铁……12306🐮🍺，可以选座，不用好友助力，芜湖！
华为,2020-12-26,1,呕，这软件，我真是吐了呀！又要我们登陆这个APP下单，不能用其他抢票，又不搞好一点，我第一次登陆后忘记密码，搞完登上就要一个星期，然后需要实名制，要刷脸核验身份，结果一个星期了还是没核好 ，我票也买不了，国家的铁路，就不能搞好一点么
华为,2020-12-26,1,说实话，这个软件做的真是太一般了。登不上去怎么搞
华为,2020-12-26,1,还不如第三方购票软件呢
华为,2020-12-26,1,差评，预计十秒，我排了一整天的队，建议下架这个软件
华为,2020-12-26,2,一不小心点到了注销了咋办
华为,2020-12-26,1,上面显示有票，点进去说查询失败，一直点一直失败，要点了好久才可以买，选好票还直接付不了钱，要返回订单未完成才可以支付，你也是够了，无语
华为,2020-12-26,1,世界铁路第一大国却做不出好的购票软件？
华为,2020-12-26,1,软件不好用  密码正确却老是登不上去  浪费时间
华为,2020-12-26,2,这啥玩意让我登录可是输密码也不好用我重置密码再登录也登录不上刷脸也不行？这啥玩意？
华为,2020-12-26,1,东北入关的票为什么那么少，app花里胡哨一大堆广告，发个验证码还要用短信，想钱想疯了？铁路局是我见过的最大爷的公司
华为,2020-12-26,1,真的太差了，更新之后死活登不上
华为,2020-12-26,1,一星都不想给，我想改签找不到选项我以为在退票选项里，结果一点就退票了，连个确认页面都没有直接退了还不是全款退的，这种软件的错凭什么顾客买单
华为,2020-12-26,1,什么鬼软件  查询 登录了  购票还要登录
华为,2020-12-26,2,这个版本登录不了，一登录就返回了
华为,2020-12-26,1,更新之后一直登不上去是什么鬼，密码正确也登不上 ，指纹登录也登不上？你玩我呢？
华为,2020-12-26,3,前几天用还好好的，今天进去为什么闪退了，进都进不到了，重新下载也进不到，为什么？？？
华为,2020-12-26,1,很少给差评，我就想看个线路站点时间，一直频繁无脑的申请涉嫌头和图库权限做什么。
华为,2020-12-26,5,非常好用，方便快捷
