"Crowd-Based Ambient Assisted Living to Monitor the Elderlys Health Outdoors","A. C. Bicharra Garcia; A. S. Vivacqua; N. Snchez-Pi; L. Mart; J. M. Molina",Federal University of the State of Rio de Janeiro; Federal University of Rio de Janeiro; Rio de Janeiro State University; Fluminense Federal University; Carlos III University of Madrid,"IEEE Software","13 Nov 2017","2017","34","6","53","57","The SafeNeighborhood approach combines data from multiple sources with collective intelligence. It merges mobile, ambient, and AI technologies with old-fashioned neighborhood ties to create safe outdoor spaces for the elderly. We're exploring AAL techniques in outdoor environments to increase the elderly's independence without them having to interact with technology. Current research in outdoor monitoring relies solely on sensor data.4 Our approach, which we call SafeNeigborhood (SN), crowdsources people in the neighborhood to revise the computer's inferences from contextual and sensor data. So, SN brings the community together to provide a safer environment for the elderly.","1937-4194","","10.1109/MS.2017.4121217","","https://ieeexplore.ieee.org/stamp/stamp.jsp?arnumber=8106875","human-centered computing;handicapped persons;special needs;healthcare;care for the elderly;ambient assisted living;SafeNeighborhood;software engineering;software development;context-aware and smart healthcare","Senior citizens;Monitoring;Temperature sensors;Global Positioning System;Mobile communication;Assisted living;Biomedical monitoring;Smart devices","ambient intelligence;artificial intelligence;assisted living;geriatrics;health care","computer inferences;outdoor monitoring;outdoor environments;AAL techniques;AI technologies;SafeNeighborhood approach;elderly health outdoor monitoring;crowd-based ambient assisted living","","5","","10","","13 Nov 2017","","","IEEE","IEEE Magazines"
"Examining the Rating System Used in Mobile-App Stores","I. J. Mojica Ruiz; M. Nagappan; B. Adams; T. Berger; S. Dienst; A. E. Hassan","McAfee; Rochester Institute of Technology; cole Polytechnique de Montral; University of Waterloo; University of Leipzig; Queen's University, Canada","IEEE Software","28 Oct 2016","2016","33","6","86","92","Unlike products on Amazon.com, mobile apps are continuously evolving, with new versions rapidly replacing the old ones. Nevertheless, many app stores still use an Amazon-style rating system, which aggregates every rating ever assigned to an app into one store rating. To examine whether the store rating captures the changing user satisfaction levels regarding new app versions, researchers mined the store ratings of more than 10,000 mobile apps in Google Play, every day for a year. Even though many apps' version ratings rose or fell, their store rating was resilient to fluctuations once they had gathered a substantial number of raters. The conclusion is that current store ratings aren't dynamic enough to capture changing user satisfaction levels. This resilience is a major problem that can discourage developers from improving app quality.","1937-4194","","10.1109/MS.2015.56","","https://ieeexplore.ieee.org/stamp/stamp.jsp?arnumber=7045413","mobile apps;Android;Google Play;review systems;rating;software development;software engineering","Mobile communication;Google;Androids;Humanoid robots;Computer applications;Software engineering","customer satisfaction;mobile computing","mobile-app stores;mobile applications;Amazon-style rating system;user satisfaction level;app versions;Google Play;app quality","","24","","10","IEEE","19 Feb 2015","","","IEEE","IEEE Magazines"
"Software process improvement in small organizations: a case study","K. C. Dangle; P. Larsen; M. Shaw; M. V. Zelkowitz","Fraunhofer Center for Exp. Software Eng., College Park, MD, USA; Fraunhofer Center for Exp. Software Eng., College Park, MD, USA; Fraunhofer Center for Exp. Software Eng., College Park, MD, USA; NA","IEEE Software","31 Oct 2005","2005","22","6","68","75","The Capability Maturity Model for software has become a major force in software development process improvement. We looked at the role of process improvement in the context of a small organization. Although the Capability Maturity Model integration is replacing the CMM, we focused on the older CMM. We had to look at more than which CMM key process areas apply to small businesses. Our overall goal was to institute good software development practices, we used the language of the CMM to gain the management's cooperation. Applying these practices is essential to managing growth, yet undertaking this effort without prior experience could impede a small company's innovative nature. This case study's purpose was to investigate the success factors of a software process improvement effort for a small software development organization.","1937-4194","","10.1109/MS.2005.162","","https://ieeexplore.ieee.org/stamp/stamp.jsp?arnumber=1524917","CMM;organizational culture;process improvement;small companies","Computer aided software engineering;Coordinate measuring machines;Project management;Quality management;Software quality;Area measurement;Capability maturity model;Software engineering;Programming;Management training","Capability Maturity Model;software development management;organisational aspects","software development process improvement;small organization;Capability Maturity Model;CMM key process area;software development organization","","42","","4","","31 Oct 2005","","","IEEE","IEEE Magazines"
"On-the-fly program modification: systems for dynamic updating","M. E. Segal; O. Frieder","Bellcore, Morristown, NJ, USA; NA","IEEE Software","6 Aug 2002","1993","10","2","53","65","Several dynamic software-based updating systems that are in the research and production stages are described. In particular, the procedure-oriented dynamic updating system (PODUS) is discussed. In PODUS, a program is updated by loading the new version of the program and replacing each old procedure with its corresponding new procedure during execution. Updating a procedure involves changing the binding from its current version to the new version. When all procedures have been replaced by their corresponding new versions, the program update is completed.<<ETX>></ETX>","1937-4194","","10.1109/52.199735","","https://ieeexplore.ieee.org/stamp/stamp.jsp?arnumber=199735","","Computer bugs;Costs;Control systems;Space vehicles;Switching systems;Hardware","software maintenance","on-the-fly program modification;dynamic updating;dynamic software-based updating systems;procedure-oriented dynamic updating system","","88","30","10","","6 Aug 2002","","","IEEE","IEEE Magazines"
"Reengineering a configuration-management system","O. Bray; M. M. Hess","Dept. of Inf. Technol., Sandia Nat. Labs., Albuquerque, NM, USA; Dept. of Inf. Technol., Sandia Nat. Labs., Albuquerque, NM, USA","IEEE Software","6 Aug 2002","1995","12","1","55","63","Developers at Sandia successfully reengineered a 30-year-old system, whose source code and documentation was incomplete, into a client-server application. Their strategy was to use natural-language information modeling to understand what the system did and then rely on domain and business-process experts to define functions at the procedural level.<<ETX>></ETX>","1937-4194","","10.1109/52.363165","","https://ieeexplore.ieee.org/stamp/stamp.jsp?arnumber=363165","","Application software;Documentation;Data engineering;Databases;Engineering drawings;Network servers;Business process re-engineering;Laboratories;Energy management;Engineering management","systems re-engineering;configuration management;project management;software development management;system documentation","configuration-management system reengineering;source code;documentation;client-server application;natural-language information modeling;business-process experts","","3","","3","","6 Aug 2002","","","IEEE","IEEE Magazines"
"A linguistic-engineering approach to large-scale requirements management","J. Natt och Dag; B. Regnell; V. Gervasi; S. Brinkkemper","Dept. of Commun. Syst., Lund Univ., Sweden; Dept. of Commun. Syst., Lund Univ., Sweden; NA; NA","IEEE Software","10 Jan 2005","2005","22","1","32","39","For large software companies, the sheer number of textual requirements presents specific challenges. To find market opportunities, organizations must continuously elicit new requirements and reevaluate old ones as market needs evolve. Developing large, complex software products aimed at broad markets involves identifying and maintaining the link between product requirements and the massive inflow of customers' wishes. Automating this support through linguistic engineering could save considerable time and improve software quality.","1937-4194","","10.1109/MS.2005.1","","https://ieeexplore.ieee.org/stamp/stamp.jsp?arnumber=1377120","requirements engineering;large-scale requirements management;natural language processing;linguistic engineering;requirement relationships;requirements similarity;requirement duplicates;redundancy","Large-scale systems;Maintenance engineering;Computer architecture;Software maintenance;Software quality;Decision making;Information analysis;Couplings;Software architecture;Financial management","knowledge management;customer relationship management;computational linguistics;DP industry;natural languages;formal specification;software quality","software companies;software product;software quality;linguistic-engineering approach;large-scale requirements engineering management;natural language;customer communication","","64","","8","","10 Jan 2005","","","IEEE","IEEE Magazines"
"Is Your Upgrade Worth It? Process Mining Can Tell","M. van Genuchten; R. Mans; H. Reijers; D. Wismeijer","VitalHealth Software, Ede; Eindhoven University of Technology, Eindhoven; Eindhoven University of Technology, Eindhoven; ACTA, Amsterdam","IEEE Software","15 Sep 2014","2014","31","5","94","100","Software vendors typically release updates and upgrades of their software once or twice a year. Users are then faced with the question of whether the upgrade is worth the price and the trouble. The software industry doesn't provide much evidence that it's worthwhile to upgrade to new releases. The authors propose the use of process mining to prove that upgrading to the next release provides quantifiable benefits to the end user. Process mining capitalizes on the fact that event logs capture information about processes. These events can be used to make processes visible and show the benefits of using a software product's next release. Three groups benefits from this process: end users, software suppliers, and researchers. The authors applied process mining to a medical software product and captured empirical data from 1,400 cases. The data shows that the new version was 11 percent more efficient than the old release.","1937-4194","","10.1109/MS.2014.20","","https://ieeexplore.ieee.org/stamp/stamp.jsp?arnumber=6728931","usability;process mining;product metrics","Usability;Data mining;Software measurements","data mining;software maintenance","process mining;software vendors;software updates;software upgrades;software industry;event logs;software product release;medical software product;empirical data","","6","","15","IEEE","30 Jan 2014","","","IEEE","IEEE Magazines"
"Prospects for an engineering discipline of software","M. Shaw","Dept. of Comput. Sci., Carnegie Mellon Univ., Pittsburgh, PA, USA","IEEE Software","6 Aug 2002","1990","7","6","15","24","Although software engineering is not yet a true engineering discipline, it has the potential to become one. Older engineering fields are examined to ascertain the character that software engineering might have. The current state of software technology is discussed, covering information processing as an economic force, the growing role of software in critical applications, the maturity of development techniques, and the scientific basis for software engineering practice. Five basic steps that the software engineering profession must take to become a true engineering discipline are described. They are: understanding the nature of expertise, recognizing different ways to get information, encouraging routine practice, expecting professional specializations, and improving the coupling between science and commercial practice.<<ETX>></ETX>","1937-4194","","10.1109/52.60586","","https://ieeexplore.ieee.org/stamp/stamp.jsp?arnumber=60586","","Knowledge engineering;Design engineering;Software design;Reliability engineering;Software engineering;Production;Software development management;Programming;Mathematics;Buildings","software engineering","engineering discipline;software engineering;software technology;information processing;economic force;critical applications;development techniques;scientific basis;expertise;routine practice;professional specializations;science;commercial practice","","163","1","16","","6 Aug 2002","","","IEEE","IEEE Magazines"
"Using Modem Design Practices to Upgrade Aging Software Systems","R. N. Britcher; J. J. Craig",IBM; NA,"IEEE Software","11 Sep 2006","1986","3","3","16","24","Modifying 100,000 lines of 20-year-old code, IBM-FSD successfully applied its software engineering principles to modernization of the FAA'S air traffic control system.","1937-4194","","10.1109/MS.1986.233407","","https://ieeexplore.ieee.org/stamp/stamp.jsp?arnumber=1695537","","Modems;Aging;Software systems;Software maintenance;FAA;Air traffic control;Embedded software;Control systems;Software standards;Computer interfaces","","","","14","1","9","","11 Sep 2006","","","IEEE","IEEE Magazines"
"Organizing Security Patterns","M. Hafiz; P. Adamczyk; R. E. Johnson",University of Illinois; University of Illinois; University of Illinois,"IEEE Software","9 Jul 2007","2007","24","4","52","60","Early software systems communicated in predefined ways, so they were easy to secure. However, the old ways of ensuring software systems' security and reliability are inadequate on the Internet. Although building secure systems is difficult, retrofitting existing systems to introduce security is even harder. For example, sendmail, the most popular mail transfer agent, has been plagued with security vulnerabilities ever since the Morris worm first exploited it in 1988.","1937-4194","","10.1109/MS.2007.114","","https://ieeexplore.ieee.org/stamp/stamp.jsp?arnumber=4267603","patterns;security;protection","Organizing;Security;Authentication;Books;Catalogs;Web services;Java;Software systems;Internet;Steel","object-oriented methods;security of data","security patterns organization;software systems security;Internet","","60","","7","","9 Jul 2007","","","IEEE","IEEE Magazines"
"Cash cow in the tar pit: reengineering a legacy system","W. S. Adolph","British Columbia Inst. of Technol., Burnaby, BC, Canada","IEEE Software","6 Aug 2002","1996","13","3","41","47","Many old systems are still with us and burden us with baggage, but replacing them, particularly when they are legacy systems, is not as straightforward as it seems. The author imparts some of the lessons learned on a legacy-replacement project.","1937-4194","","10.1109/52.493019","","https://ieeexplore.ieee.org/stamp/stamp.jsp?arnumber=493019","","Costs;Risk management;Rail transportation;Software engineering;Manufacturing;Project management;Software systems;Hardware;Software performance;Software tools","systems re-engineering;software development management;software maintenance;business data processing","systems reengineering;legacy system;legacy-replacement project;software development projects;software maintenance;business","","25","","5","","6 Aug 2002","","","IEEE","IEEE Magazines"
"Completing the job interface design","J. Rudolf; C. Waite",NA; NA,"IEEE Software","6 Aug 2002","1992","9","6","11","22","HyperNews, a user-interface management system that lets a user separate application and interface design to link a new interface to an old application with very little programming, is described. Much of a HyperNews interface can be designed without writing any code at all. With direct manipulation, a user can design a graphical user interface simply by creating, moving, and resizing objects on the screen. Experimentation with different interface styles is possible with less effort in HyperNews compared to specification languages and tool kits, and immediate feedback can result in extremely fast development. The ways HyperNews provides communication capabilities among all HyperNews objects (such as control objects, cards, backgrounds, and stacks) and links interfaces to internal applications, which were developed within HyperNews, to external applications, or to existing applications developed without HyperNews are discussed.<<ETX>></ETX>","1937-4194","","10.1109/52.168854","","https://ieeexplore.ieee.org/stamp/stamp.jsp?arnumber=168854","","Job design;Graphics;Programming profession;Workstations;Displays;Mice;Graphical user interfaces;Psychology;Runtime;Specification languages","graphical user interfaces;hypermedia;user interface management systems","object creation;object moving;object resizing;job interface design;HyperNews;user-interface management system;direct manipulation;graphical user interface;interface styles;control objects;cards;backgrounds;stacks","","2","4","8","","6 Aug 2002","","","IEEE","IEEE Magazines"
"How Much of the Software Engineering Old Still Remains New?","R. L. Glass",NA,"IEEE Software","17 Jul 2006","2006","23","4","104","104","Oddly enough, many software engineering issues and conflicts that were relevant 20 years ago are still relevant today.","1937-4194","","10.1109/MS.2006.106","","https://ieeexplore.ieee.org/stamp/stamp.jsp?arnumber=1657949","software engineering;programming","Software engineering;Books;Open source software;Permission;Automatic programming;Sections;Writing;Building materials;Software systems;Australia","","software engineering;programming","","","","","","17 Jul 2006","","","IEEE","IEEE Magazines"
"Usability metrics: tracking interface improvements","J. Nielsen","SunSoft 2550 Garcia Ave MPK 17-305 Mountain View, CA 94043","IEEE Software","19 Jun 2019","1996","13","6","1","2","It is argued that most usability engineering is qualitative in nature: you observe how users use your product - what they have difficulty doing, what they like, and what they hate - then you refine your design accordingly. Given the severe time pressure in most development projects, it's enough to know that something is good or bad. Rarely is it necessary or possible to take the time to find out how good or bad, since if it's good you want to leave it alone and if it is bad you want to change it (if you have time, that is). There are some cases, though, where you do want numbers. The author does not recommend usability metrics for all projects; qualitative methods are usually sufficient to ensure substantial usability improvements. That would mean you won't know bow much better your new design is, but as long as it is not worse than the old one, going with the new one is clearly the better decision. However, organizations that do extensive software development and care about their engineering maturity should collect metrics for at least some of their projects.","1937-4194","","10.1109/MS.1996.8740869","","https://ieeexplore.ieee.org/stamp/stamp.jsp?arnumber=8740869","","","","","","2","","","","19 Jun 2019","","","IEEE","IEEE Magazines"
"Perspectives [The changing nature of software evolution; The inevitability of evolution]","B. Boehm; K. Beck",University of Southern California; Three Rivers Institute,"IEEE Software","14 Jun 2010","2010","27","4","26","29","Summary form only given. Traditionally, software evolution took place after software development put a system in place. However, the pace of change in technology and competition has changed the nature of software evolution to a continuous process, in which there's no neat boundary between development and evolution. Many traditional software development assumptions and practices haven't recognized this changing nature and increasingly find themselves in deep trouble as a result. Minimizing development costs by adopting numerous off-the-shelf products often leads to unaffordable evolution costs as vendors ship new releases and stop supporting the old ones. Assuming that a single form of evolutionary development covers all situations often leads to unrealistic commitments and dead-end systems as situations change.","1937-4194","","10.1109/MS.2010.103","","https://ieeexplore.ieee.org/stamp/stamp.jsp?arnumber=5484112","software evolution;software engineering;software change;development","Programming;Costs;Lead;Marine vehicles","software engineering","software evolution;software development;off-the-shelf software products;evolutionary development","","8","","14","","14 Jun 2010","","","IEEE","IEEE Magazines"
"Guest Editor's Introduction: The Promise of Public Software Engineering Data Repositories","B. Cukic",West Virginia University,"IEEE Software","31 Oct 2005","2005","22","6","20","22","Scientific discovery related to software is based on a centuries-old paradigm common to all fields of science: setting up hypotheses and testing them through experiments. Repeatedly confirmed hypotheses become models that can describe and predict real-world phenomena. The best-known models in software engineering describe relationships between development processes, cost and schedule, defects, and numerous software ""-ilities"" such as reliability, maintainability, and availability. But, compared to other disciplines, the science of software is relatively new. It's not surprising that most software models have proponents and opponents among software engineers. This introduction to the special issue discusses the power of modeling, the promise of data repositories, and the workshop devoted to this topic.","1937-4194","","10.1109/MS.2005.153","","https://ieeexplore.ieee.org/stamp/stamp.jsp?arnumber=1524910","software engineering methodologies;software engineering validation;model checking;process metrics;software science","Software engineering;Predictive models;Software measurement;Databases;Data analysis;Circuit faults;Failure analysis;Testing;Costs;Software maintenance","","software engineering methodologies;software engineering validation;model checking;process metrics;software science","","8","","5","","31 Oct 2005","","","IEEE","IEEE Magazines"
"Novelty in Sameness","H. Erdogmus",National Research Council Canada,"IEEE Software","30 Apr 2007","2007","24","3","5","7","Novelty and sameness can conceal each other. Regardless of how things might appear in hindsight, we risk missing the mark if we indiscriminately insist on seeing new proposals and emerging movements simply as reincarnations of old advice, whether to justify or refute them.","1937-4194","","10.1109/MS.2007.82","","https://ieeexplore.ieee.org/stamp/stamp.jsp?arnumber=4163015","incremental development;iterative development;phased development;staged development","Prototypes;Feedback loop;Proposals;Councils;Software testing;Software prototyping;Application software;Software systems;Process design;Computer Society","","","","","","","","30 Apr 2007","","","IEEE","IEEE Magazines"
"Designing a World at Your Fingertips: A Look at Mobile User Interfaces","F. Shull",Fraunhofer Center for Experimental Software Engineering,"IEEE Software","10 Aug 2012","2012","29","4","4","7","Smart mobile devices have had a huge impact on the world today with new apps being produced at a prodigious rate. How we got to this point has a lot to do with the ease of use that manufacturers and app developers have achieved, which includes aspects such as quick response time, intuitive interfaces, and well-designed functionality. To explore how this came about, IEEE Software Editor-in-Chief Forrest Shull recently spoke with Ben Shneiderman and Ben Bederson, both of whom are former directors of the University of Maryland's Human-Computer Interaction Lab (HCIL), the oldest center in the US focusing on research in HCI.","1937-4194","","10.1109/MS.2012.81","","https://ieeexplore.ieee.org/stamp/stamp.jsp?arnumber=6265071","software;engineering;smart phones;mobile devices;apps;functionality;interfaces;hci;human-computer interaction;lab;HCIL","","","","","1","","","","10 Aug 2012","","","IEEE","IEEE Magazines"
"Technology Transfer and the Tech Broker","W. Harrison",NA,"IEEE Software","6 Sep 2006","2006","23","5","5","7","Technology transfer is the process of transferring an idea from its originator to someone who can use it. Typically, this implies the transfer of research developed in academia to industry. While there's no dearth of technologies that academic researchers have available and are anxious to transfer, precious little technology transfer involving academia takes place, at least in the software development community. Why don't we see more tech transfer in our field? What the software community needs is an infrastructure that matches researchers with adopters at a specific point in time and helps them overcome the administrative barriers. One example of a successful technology broker is SERC, a two-decade-old consortium of industrial organizations and universities that facilitates the brokering of technology transfer from academia to industry.","1937-4194","","10.1109/MS.2006.142","","https://ieeexplore.ieee.org/stamp/stamp.jsp?arnumber=1687852","technology transfer","Technology transfer;Production;Space technology;Time measurement;Packaging;Heart;Vehicles;Software engineering;Engineering profession;Computer Society","","technology transfer","","","","","","6 Sep 2006","","","IEEE","IEEE Magazines"
