"Document Title",Authors,"Author Affiliations","Publication Title",Date Added To Xplore,"Publication Year","Volume","Issue","Start Page","End Page","Abstract","ISSN",ISBNs,"DOI",Funding Information,PDF Link,"Author Keywords","IEEE Terms","INSPEC Controlled Terms","INSPEC Non-Controlled Terms","Mesh_Terms",Article Citation Count,Patent Citation Count,"Reference Count","License",Online Date,Issue Date,"Meeting Date","Publisher",Document Identifier
"Requirements Elicitation with and for Older Adults","H. Sustar; U. Pfeil; P. Zaphiris",City University London; City University London; City University London,"IEEE Software","25 Apr 2008","2008","25","3","16","17","The study investigated the strengths and weaknesses of existing user-centered design (UCD) methods for eliciting requirements from older adults. A case study in which older people are involved in designing, developing, and evaluating a virtual-garden prototype. Users could potentially employ this device (which has an interface that resembles a real garden) as an empathic information appliance that would provide weather forecasts and help control smart devices and assistive technologies. Creativity-oriented techniques are suggested to designers, developers, and engineers when creating products so that older people are included in the market consideration.","1937-4194","","10.1109/MS.2008.69","","https://ieeexplore.ieee.org/stamp/stamp.jsp?arnumber=4497756","older adults;empathic interfaces;user-centered design","Auditory system;User centered design;Weather forecasting;Demography;Design engineering;Usability;Animation;Capacitive sensors;Acoustical engineering;Power engineering and energy","geriatrics;home computing;product design;user centred design;user interfaces","user-centered design;older adults;user interface;smart devices;assistive technologies;creativity;product design","","2","","2","","25 Apr 2008","","","IEEE","IEEE Magazines"
"Is 40 the New 60? How Popular Media Portrays the Employability of Older Software Developers","S. Baltes; G. Park; A. Serebrenik","QAware Gmb, Germany; Software Engineering, Itility B.V.; Software Engineering, Eindhoven University of Technology, Eindhoven, The Netherlands","IEEE Software","23 Oct 2020","2020","37","6","26","31","We studied the public discourse around age and software development, focusing on the United States. This work was designed to build awareness among decision makers in software projects to help them anticipate and mitigate challenges that their older employees may face.","1937-4194","","10.1109/MS.2020.3014178","","https://ieeexplore.ieee.org/stamp/stamp.jsp?arnumber=9157881","","Software;Media;Computer hacking;Industries;Face;Engineering profession;Companies","decision making;organisational aspects;personnel;project management;software engineering","popular media portrays;employability;older software developers;software development;United States;software projects;older employees;decision making","","","","19","IEEE","4 Aug 2020","","","IEEE","IEEE Magazines"
"Testing tools combine best of new and old","R. M. Poston","PEI Div., Interactive Dev. Environ. Inc., Iselin, NJ, USA","IEEE Software","6 Aug 2002","1995","12","2","122","126","Today, new testing tools are giving life to old ones by providing reliable input to and automatically evaluating the output from old tools. Old and new tools are working together to cover the entire testing process. This article explains how old testing tools work with new ones in each phase of the life cycle.<<ETX>></ETX>","1937-4194","","10.1109/52.368294","","https://ieeexplore.ieee.org/stamp/stamp.jsp?arnumber=368294","","Life testing;Automatic testing;System testing;Isolation technology;Content addressable storage;Jacobian matrices","program testing;software tools","program testing tools;new tools;old tools;testing process;software life cycle;software tools","","1","","","","6 Aug 2002","","","IEEE","IEEE Magazines"
"This old house [software development]","D. O'Day","Elite Inf. Syst., Los Angeles, CA, USA","IEEE Software","6 Aug 2002","1998","15","2","72","75","Comparing the improvement of existing software development processes to fixing up an old house, the author argues that working on one item at a time can be more practical than starting from the ground up. The author works at a software company that he imagines resembles many others. The company started out with five employees, including one programmer, and has grown to about 170 employees and $35 million a year in sales. Naturally the organization has experienced growing pains, and it is currently redefining what development means at the company. The article presents the author's view of the company's struggle to improve.","1937-4194","","10.1109/52.663789","","https://ieeexplore.ieee.org/stamp/stamp.jsp?arnumber=663789","","Companies;Loans and mortgages;Fluid flow;Paints;Resists;Costs;Programming profession","software development management;DP industry;human resource management","software development processes;old house;software company","","1","","1","","6 Aug 2002","","","IEEE","IEEE Magazines"
"Nine Things You Can Do with Old Software","G. Booch",IBM,"IEEE Software","19 Aug 2008","2008","25","5","93","94","Every new line of code quickly becomes legacy. When that legacy mounts, it forms a significantly massive pile of software, which cannot be ignored. This article discusses what we can do intentionally with such piles, from abandonment to evolution and many things in between.","1937-4194","","10.1109/MS.2008.139","","https://ieeexplore.ieee.org/stamp/stamp.jsp?arnumber=4602682","software architecture;software architecture economics;software development life cycle","Software maintenance;Costs;Power generation economics;Assembly;Software systems;Casting;Aging;Programming;Software measurement;Technological innovation","","","","","","","","19 Aug 2008","","","IEEE","IEEE Magazines"
"Open source software ERPs: a new alternative for an old need","N. Serrano; J. M. Sarriei","Univ. of Navarra, Spain; Univ. of Navarra, Spain","IEEE Software","8 May 2006","2006","23","3","94","97","Both OSS ERPs and proprietary ERPs involve complex system implementations that usually require modifications to a firm's business processes as well as some adaptation of the ERP' functionality. This mutual matching project usually involves consulting firms. However, the benefits of applying OSS are greater for ERPs than for other kinds of applications, for three main reasons: increased adaptability, decreased reliance on a single supplier, reduced costs","1937-4194","","10.1109/MS.2006.78","","https://ieeexplore.ieee.org/stamp/stamp.jsp?arnumber=1628946","ERP;enterprise resource planning;open source;management information systems","Open source software;Enterprise resource planning;Management information systems;Licenses;Companies;Costs;Application software;Dictionaries;Resource management;Information management","enterprise resource planning;public domain software","open source software;ERP;OSS;mutual matching project","","40","","6","","8 May 2006","","","IEEE","IEEE Magazines"
"Now That Objects are Old Hat, Quo Vadis, Oppsla?","A. Burgess",NA,"IEEE Software","6 Aug 2002","1996","13","1","106","","","1937-4194","","10.1109/MS.1996.476295","","https://ieeexplore.ieee.org/stamp/stamp.jsp?arnumber=476295","","Sun;Corporate acquisitions;Prototypes;Bridges;Java;Web sites;Investments;Muscles;Protection;Object oriented modeling","","","","","","","","6 Aug 2002","","","IEEE","IEEE Magazines"
"Sometimes the Old Ways Are Best","B. Kernighan",Princeton University,"IEEE Software","11 Nov 2008","2008","25","6","18","19","Brian Kernighan looks back at what has and has not changed in computing, programming, and tools over the last 30 years. He discusses what we want from our tools and reveals his favorites.","1937-4194","","10.1109/MS.2008.161","","https://ieeexplore.ieee.org/stamp/stamp.jsp?arnumber=4670705","software tool;software development tool;integrated development environment","Software tools;Programming profession;Forensics;Assembly;Computer hacking;Linux;Books;Java;Safety;Environmental management","","","","","","","","11 Nov 2008","","","IEEE","IEEE Magazines"
"Community Collaboration for ERP Implementation","H. Wu; L. Cao",Old Dominion University; Old Dominion University,"IEEE Software","16 Oct 2009","2009","26","6","48","55","The paper discusses the enterprise resource planning (ERP).ERP implementation solves business problems by customizing and integrating off-the-shelf enterprise software packages. A successful ERP implementation involves extensive collaboration and communication among the customer, implementation consultancy, and software vendor. Collaboration allows implementation personnel from different organizations to utilize each other's experiences. An example of this is the Web 2.0. A Web 2.0 knowledge repository system can reduce costs, improve quality, and lower the risks of ERP implementations.Through the case study, the key desired features for Web 2.0 knowledge repository system to support ERP implementations were defined. Epics was designed to fulfill these requirements and developed a prototype. Epics can be used by software vendors, ERP consulting firms, and ERP users. Human aspects play a critical role in ERP implementation. ERP implementation quality depends largely on how the implementation personnel's knowledge and past experiences are reused and communicated. Although knowledge reuse, collaboration, and communication are important for all software projects, they're particularly critical in ERP implementation owing to its unique challenges.","1937-4194","","10.1109/MS.2009.171","","https://ieeexplore.ieee.org/stamp/stamp.jsp?arnumber=5287009","Web 2.0;ERP implementation;software engineering;software implementation;packaged software;enterprise resource planning;ERP","Collaboration;Enterprise resource planning;Collaborative software;Personnel;Software packages;Costs;Software prototyping;Prototypes;Humans","data mining;enterprise resource planning;groupware;Internet;software reusability;software tools","ERP implementation;community collaboration;enterprise software packages;software vendor;Web 2.0 knowledge repository system;Epics software;ERP consulting firms;ERP users;knowledge reuse;communication","","13","1","12","","16 Oct 2009","","","IEEE","IEEE Magazines"
"Software lives too long","J. C. Munson","Dept. of Comput. Sci., Idaho Univ., Moscow, ID, USA","IEEE Software","6 Aug 2002","1998","15","4","18","","Old programs represent yesterday's technology. We have has learned quite a bit about software engineering methodology in the last few years. We now know, for example, that requirements traceability is central to program maintainability-if we don't know what a program is supposed to do we cannot maintain it. We know that calendar years have four digits in them, not two. We know that data can best be managed in databases. We know that many of the utility functions once written into programs are best handled by the operating system. And we have new design constructs and new programming language features that permit us to design eminently maintainable programs. When the cost of maintaining old buildings becomes excessive, we replace these buildings. We must do the same with old programs. Programs do not age well-written for hardware systems and operating systems that typically no longer exist many are fraught with undocumented patches and features. Just as we have learned that it is wise to invest in new hardware and new buildings, we must learn to recognize the value of replacing drafty and rickety old software.","1937-4194","","10.1109/52.687938","","https://ieeexplore.ieee.org/stamp/stamp.jsp?arnumber=687938","","Automatic programming;Software maintenance;Application software;Computer languages;Magnetic heads;Operating systems;Buildings;Hardware;Software reliability;Aging","software maintenance","software engineering methodology;old programs;requirements traceability;program maintainability;utility functions;databases;operating systems;design constructs;programming language features;hardware systems","","","","","","6 Aug 2002","","","IEEE","IEEE Magazines"
"A fresh perspective on old problems [software industry]","R. Fleming","1331 Avalon St., Klamath Falls, OR, USA","IEEE Software","6 Aug 2002","1999","16","1","106","113","The author documents the lessons he learned while working as an intern at a growing telecommunications company. Though his conclusions are not surprising, they can serve as reminders of how common certain problems are in the software industry and how important basic practices can be. Initially he spent his time debugging, extending and updating the company's in-house billing/provisioning system, and dealt primarily with code, code-level quality, and program documentation issues. Soon, however, opportunities arose for him to contribute ideas that ultimately affected the entire department. These opportunities in turn provided him with valuable lessons about essential yet often overlooked software development issues, from programming practices to team organization.","1937-4194","","10.1109/52.744577","","https://ieeexplore.ieee.org/stamp/stamp.jsp?arnumber=744577","","Programming profession;Debugging;Documentation;Productivity;Chaotic communication;Books;Communication effectiveness","DP industry;software engineering;telecommunication computing","telecommunications company;software industry;program debugging;system updating;billing system;provisioning system;software quality;program documentation;software development;programming practices;team organization","","2","","3","","6 Aug 2002","","","IEEE","IEEE Magazines"
"Helix: The Architecture of the XMS Distributed File system","M. Fridrich; W. Older",BNR; NA,"IEEE Software","11 Sep 2006","1985","2","3","21","29","With abstraction layering and system decomposition, all the user sees is one homogeneous system. In actuality, the architecture is supporting 15 LANs and close to 1000 workstations.","1937-4194","","10.1109/MS.1985.230697","","https://ieeexplore.ieee.org/stamp/stamp.jsp?arnumber=1695332","","File systems;Computer architecture;Local area networks;Software architecture;Drives;Winches;File servers;Printers;Workstations;Buildings","","","","8","","6","","11 Sep 2006","","","IEEE","IEEE Magazines"
"Are Domain-Specific Models Easier to Maintain Than UML Models?","L. Cao; B. Ramesh; M. Rossi",Old Dominion University; Georgia State University; Helsinki School of Economics,"IEEE Software","19 Jun 2009","2009","26","4","19","21","Although domain-specific modeling (DSM) languages have been adopted in industries such as telecommunications and insurance, they haven't yet gained wide acceptance in practice. This is because the claims of increased productivity and ease of understanding haven't yet been verified by independent studies. To address this concern, we examined a DSM language's performance for maintenance tasks. Maintenance in software-intensive systems is critical because software often continuously evolves during development as well as after delivery, to meet users' ever-changing needs. So, maintenance performance significantly impacts software development productivity.Experimental results show that maintenance can be significantly easier and faster with a DSM language than with a general- purpose modeling language.","1937-4194","","10.1109/MS.2009.87","","https://ieeexplore.ieee.org/stamp/stamp.jsp?arnumber=5076454","visual programming;programming techniques;design notations and documentation;design representation;design maintainability;software distribution;software maintenance","Unified modeling language;Object oriented modeling;Industrial training;Productivity;Testing;System analysis and design;Domain specific languages;Mobile handsets;Performance evaluation;Error correction","software architecture;software maintenance;software performance evaluation;specification languages","domain-specific modeling language performance;software-intensive system maintenance;software development productivity;UML model","","9","","2","","19 Jun 2009","","","IEEE","IEEE Magazines"
"Agile Documentation, Anyone?","B. Selic",Malina Software Corp.,"IEEE Software","16 Oct 2009","2009","26","6","11","12","Software developers are notorious for skimping on design documentation, often eschewing it altogether. This trend has led to claims that it is merely an impediment in the fast-paced and highly pliable world of software development-a useless vestige of old-style engineering that should be eliminated altogether. While recognizing the unique nature of software, the author argues that, because of the complexity of modern software systems and the cryptic nature of current programming languages, good design documentation is not only useful but vital. However, we must seek ways of adapting it to suit the medium as well as the exceptionally dynamic development process.","1937-4194","","10.1109/MS.2009.167","","https://ieeexplore.ieee.org/stamp/stamp.jsp?arnumber=5287001","Documentation;Software engineering;Software maintenance","Documentation;Impedance;Software systems;Computer languages","software engineering;system documentation","agile documentation;software development;old-style engineering;modern software system complexity;programming languages;dynamic development process","","31","","2","","16 Oct 2009","","","IEEE","IEEE Magazines"
"Agile Requirements Engineering Practices: An Empirical Study","L. Cao; B. Ramesh",Old Dominion University; Georgia State University,"IEEE Software","7 Jan 2008","2008","25","1","60","67","An analysis of data from 16 software development organizations reveals seven agile RE practices, along with their benefits and challenges. The rapidly changing business environment in which most organizations operate is challenging traditional requirements-engineering (RE) approaches. Software development organizations often must deal with requirements that tend to evolve quickly and become obsolete even before project completion. Rapid changes in competitive threats, stakeholder preferences, development technology, and time-to-market pressures make prespecified requirements inappropriate.","1937-4194","","10.1109/MS.2008.1","","https://ieeexplore.ieee.org/stamp/stamp.jsp?arnumber=4420071","requirements engineering;agile software development","Data analysis;Programming;Quality management;Project management;Software development management;Software quality;Design engineering;Feedback;Protection;Urban areas","formal specification;software prototyping;systems analysis","agile iterative requirements engineering approach;business environment;software development organization;time-to-market pressure;requirement specification;empirical study","","179","","4","","7 Jan 2008","","","IEEE","IEEE Magazines"
"Are we developers liars or just fools [software managers]","R. N. Charette","PO Box 1929, Springfield, VA, USA","IEEE Software","6 Aug 2002","1995","12","4","90","92","Things were good in the old days. Very few people understood software, so those of us who were cognoscenti could get away with murder. We could explain away cost and schedule overruns by blaming ""complexity."" Performance problems were the fault of emerging technology and if management or customers got angry, what could they do? Although nearly everything that defined ""the old days"" has changed, the author argues that many of the old foibles remain. According to the author, software managers and the people who work for them risk being viewed as liars or fools, a perception that can only harm the software community.<<ETX>></ETX>","1937-4194","","10.1109/52.391841","","https://ieeexplore.ieee.org/stamp/stamp.jsp?arnumber=391841","","Software development management;Project management;Costs;State estimation;Monitoring;Ethics;Books;Statistics;Observers;Uncertainty","software development management;personnel;social aspects of automation","software developers;software cost;software development schedule;complexity;software performance problems;software managers;software community","","","","","","6 Aug 2002","","","IEEE","IEEE Magazines"
"Integrate End to End Early and Often","F. H. Bachmann; L. Carballo; J. McHale; R. L. Nord",Software Engineering Institute; Bursatec; Software Engineering Institute; Software Engineering Institute,"IEEE Software","26 Jun 2013","2013","30","4","9","14","This column is all about stories, and this one is as exciting as a paperback whodunit. The details are all included, and I hate to spoil it, but there's a happy ending. The story is about something old--designing and implementing a new system when the old one was really old (two decades!) and something new--using outside research consultants to save the day with a secret sauce. Enjoy!","1937-4194","","10.1109/MS.2013.77","","https://ieeexplore.ieee.org/stamp/stamp.jsp?arnumber=6547611","software architecture;software process;incremental iterative development;integration;architecture-centric engineering;team software process","Computer architecture;Software development;Aging;Software engineering;Prototypes;Software testing;Software quality","software architecture","end-to-end software integration;software development project;software architecture","","4","","5","","26 Jun 2013","","","IEEE","IEEE Magazines"
"A home-page overhaul using other Web sites","J. Nielsen","SunSoft, Mountain View, CA, USA","IEEE Software","6 Aug 2002","1995","12","3","75","78","The best prototype for designing a new user interface is your old user interface. The second best prototype is a competing product. Your competitors have invested significant resources in designing and implementing what they believe to be good user interfaces. You can glean much of what you need to create a new interface by examining products designed to solve similar problems. As with your own old user interface, you can analyze competing interfaces to see what works and what doesn't. You can also watch how users interact with competing products, and thus learn how they approach tasks. This, in essence, is competitive usability analysis. I recommend performing it very early in the usability engineering life-cycle-after you have visited the customer, gathered requirements, and defined the product vision, but before you design and prototype your new user interface.<<ETX>></ETX>","1937-4194","","10.1109/52.382190","","https://ieeexplore.ieee.org/stamp/stamp.jsp?arnumber=382190","","Prototypes;User interfaces;Usability;Design engineering;Costs;Software prototyping;Web page design;Design optimization;Cloning;Product design","Internet;user interfaces;software prototyping;internetworking","World Wide Web home pages;user interface design;competing products;competitive usability analysis;usability engineering life-cycle;prototyping;WWW sites","","1","","","","6 Aug 2002","","","IEEE","IEEE Magazines"
"Requirements Engineering's Next Top Model","O. Gotel; J. Cleland-Huang",NA; DePaul University,"IEEE Software","28 Oct 2013","2013","30","6","24","29","A game-show environment let a panel competitively explore the use of various requirements modeling techniques for specifying a complex problem. Although plain old text and rich pictures emerged as the winners, real-world problems are best modeled using a variety of techniques. The Web extra at http://youtu.be/6vfIwSauj5o is an audio podcast of author Jane Cleland-Huang providing an audio recording of her Requirements column, in which she discusses how a game-show environment at the 2013 European Software Engineering Conference let a panel competitively explore the use of various requirements modeling techniques for specifying a complex problem.","1937-4194","","10.1109/MS.2013.129","","https://ieeexplore.ieee.org/stamp/stamp.jsp?arnumber=6648608","requirements;modeling","Unified modeling language;Games;Computational modeling;Adaptation models;Software engineering","","","","","","1","","28 Oct 2013","","","IEEE","IEEE Magazines"
"Aim, fire [test-first coding]","K. Beck",NA,"IEEE Software","7 Aug 2002","2001","18","5","87","89","The author argues that test-first coding is not testing. Test-first coding is not new. It is nearly as old as programming. It is an analysis technique. We decide what we are programming and what we are not programming, and we decide what answers we expect. Test-first is also a design technique.","1937-4194","","10.1109/52.951502","","https://ieeexplore.ieee.org/stamp/stamp.jsp?arnumber=951502","","Fires;Shape;Automatic testing;Software testing;Writing;Educational institutions;Logic testing;Viruses (medical);Fasteners;Quality control","systems analysis;program testing","test-first coding;program testing;programming;systems analysis;software design technique","","15","","","","7 Aug 2002","","","IEEE","IEEE Magazines"
"Interfaces for intermediates","L. L. Constantine","Constantine & Lockwood Ltd., Acton, MA, USA","IEEE Software","6 Aug 2002","1994","11","4","96","99","Intermediates (those who are neither beginners nor old hands, and who make up most of the user population) are perhaps the most neglected user segment in terms of interface design, yet there are possibly more intermediate users than beginners or experts. The author urges interface designers to take note of this segment and details a transitional interface well-suited for bridging the gap between novice and expert.<<ETX>></ETX>","1937-4194","","10.1109/52.300096","","https://ieeexplore.ieee.org/stamp/stamp.jsp?arnumber=300096","","Usability;Computer architecture;Turning;User interfaces;Computer interfaces;Programming profession;Keyboards;Impedance;Leg;Rubber","user interfaces;human factors;interactive devices;software engineering","intermediate users;user population;user segment;user interface design;user interface optimization","","","","","","6 Aug 2002","","","IEEE","IEEE Magazines"
