"An Algorithm to Decide Feasibility of Linear Integer Constraints Occurrng in Decision Tables","S. Biswas; V. Rajaraman","Department of Computer Science and Engineering, Indian Institute of Technology; NA","IEEE Transactions on Software Engineering","18 Sep 2006","1987","SE-13","12","1340","1347","To detect errors in decision tables one needs to decide whether a given set of constraints is feasible or not. This paper describes an algorithm to do so when the constraints are linear in variables that take only integer values. Decision tables with such constraints occur frequently in business data processing and in nonnumeric applications. The aim of the algorithm is to exploit. the abundance of very simple constraints that occur in typical decision table contexts. Essentially, the algorithm is a backtrack procedure where the the solution space is pruned by using the set of simple constrains. After some simplications, the simple constraints are captured in an acyclic directed graph with weighted edges. Further, only those partial vectors are considered from extension which can be extended to assignments that will at least satisfy the simple constraints. This is how pruning of the solution space is achieved. For every partial assignment considered, the graph representation of the simple constraints provides a lower bound for each variable which is not yet assigned a value. These lower bounds play a vital role in the algorithm and they are obtained in an efficient manner by updating older lower bounds. Our present algorithm also incorporates an idea by which it can be checked whether or not an (m –2)-ary vector can be extended to a solution vector of m components, thereby backtracking is reduced by one component.","1939-3520","","10.1109/TSE.1987.233144","","https://ieeexplore.ieee.org/stamp/stamp.jsp?arnumber=1702183","Backtrack algorithm;decision tables;detection of errors;integer programming","Testing;Data processing;Linear programming;Calculus;Computer science;Integer linear programming","","Backtrack algorithm;decision tables;detection of errors;integer programming","","1","","12","","18 Sep 2006","","","IEEE","IEEE Journals"
"Structured Fortran—An Evolution of Standard Fortran","A. Ralston; J. L. Wagener","Department of Computer Science, State University of New York at Buffalo; NA","IEEE Transactions on Software Engineering","18 Sep 2006","1976","SE-2","3","154","176","Fortran is 21 years old; many would say that it has not reached adulthood but senility. Yet it remains the language of use in the overwhelming majority of scientific applications of computers and no end to this situation is in sight. Moreover, its evolution through the standards process is very slow, too slow to give any hope that Fortran will ever in this way become a language in which structured programs can be easily and effectively written.","1939-3520","","10.1109/TSE.1976.233813","","https://ieeexplore.ieee.org/stamp/stamp.jsp?arnumber=1702362","Control structures;data structures;data types;Fortran extensions;procedure-oriented languages;structured programing","Natural languages;Computer languages;Surgery;Computer science;Application software;Computer applications;Vehicles;Genetic programming;Data structures;Standards publication","","Control structures;data structures;data types;Fortran extensions;procedure-oriented languages;structured programing","","1","","23","","18 Sep 2006","","","IEEE","IEEE Journals"
"Application of Principal Component Analysis to Multikey Searching","R. C. T. Lee; Y. H. Chin; S. C. Chang","Institute of Applied Mathematics, National Tsing Hua University; NA; NA","IEEE Transactions on Software Engineering","18 Sep 2006","1976","SE-2","3","185","193","In this paper, we shall introduce a concept widely used by statisticians, the principal component analysis technique. We shall show that this principal component analysis technique can be used to create new keys from a set of old keys. These new keys are very useful in narrowing down the search domain. We shall also show that the projections on the first principal component direction can be viewed as hashing addresses for the best-match searching problem.","1939-3520","","10.1109/TSE.1976.225946","","https://ieeexplore.ieee.org/stamp/stamp.jsp?arnumber=1702364","Baskett and Shustek algorithm;best-match;exact-match;hash coding for best-match searching;multikey searching;principal component analysis;the Friedman;variance","Principal component analysis;Pattern recognition;Information security;Data security;Mathematics;Computer science;Information retrieval;Personnel;Books;Statistics","","Baskett and Shustek algorithm;best-match;exact-match;hash coding for best-match searching;multikey searching;principal component analysis;the Friedman;variance","","35","","16","","18 Sep 2006","","","IEEE","IEEE Journals"
"Comparing uniform and flexible policies for software maintenance and replacement","Y. Tan; V. S. Mookerjee","Bus. Sch., Washington Univ., Seattle, WA, USA; NA","IEEE Transactions on Software Engineering","25 Apr 2005","2005","31","3","238","255","The importance of software maintenance in managing the life-cycle costs of a system cannot be overemphasized. Beyond a point, however, it is better to replace a system rather than maintain it. We derive model and operating policy that reduces the sum of maintenance and replacement costs in the useful life of a software system. The main goal is to compare uniform (occurring at fixed time intervals) versus flexible (occurring at varying, planned time intervals) polices for maintenance and replacement. The model draws from the empirical works of earlier researchers to consider 1) inclusion of user requests for maintenance, 2) scale economies in software maintenance, 3) efficiencies derived from replacing old software technology with new software technology, and 4) the impact of software reuse on replacement and maintenance. Results from our model show that the traditional practice of maintaining or replacing a software system at uniform time intervals may not be optimal. We also find that an increase in software reuse leads to more frequent replacement, but the number of maintenance activities is not significantly impacted.","1939-3520","","10.1109/TSE.2005.30","","https://ieeexplore.ieee.org/stamp/stamp.jsp?arnumber=1423995","Index Terms- Software maintenance and replacement;cost models;optimal scheduling.","Software maintenance;Software systems;Application software;Cost function;Environmental economics;Optimal scheduling;Computer industry;Software performance;Personnel;Java","software reusability;software maintenance;software cost estimation","software maintenance;software replacement;software reuse;optimal scheduling;software cost estimation","","31","","57","","25 Apr 2005","","","IEEE","IEEE Journals"
"Observations of Fallibility in Applications of Modern Programming Methodologies","S. L. Gerhart; L. Yelowitz","Department of Computer Science, Duke University; NA","IEEE Transactions on Software Engineering","18 Sep 2006","1976","SE-2","3","195","207","Errors, inconsistencies, or confusing points are noted in a variety of published algorithms, many of which are being used as examples in formulating or teaching principles of such modern programming methodologies as formal specification, systematic construction, and correctness proving. Common properties of these points of contention are abstracted. These properties are then used to pinpoint possible causes of the errors and to formulate general guidelines which might help to avoid further errors. The common characteristic of mathematical rigor and reasoning in these examples is noted, leading to some discussion about fallibility in mathematics, and its relationship to fallibility in these programming methodologies. The overriding goal is to cast a more realistic perspective on the methodologies, particularly with respect to older methodologies, such as testing, and to provide constructive recommendations for their improvement.","1939-3520","","10.1109/TSE.1976.233815","","https://ieeexplore.ieee.org/stamp/stamp.jsp?arnumber=1702366","Correctness proofs;fallibility;program correctness;program errors;program specifications;programming methodologies;reliability;testing","Education;Formal specifications;Guidelines;Mathematical programming;Testing;Computer science;Mathematics;Error correction;Frequency;Data structures","","Correctness proofs;fallibility;program correctness;program errors;program specifications;programming methodologies;reliability;testing","","54","","31","","18 Sep 2006","","","IEEE","IEEE Journals"
"A rely and guarantee method for timed CSP: a specification and design of a telephone exchange","A. Kay; J. N. Reed","Comput. Lab., Oxford Univ., UK; Comput. Lab., Oxford Univ., UK","IEEE Transactions on Software Engineering","6 Aug 2002","1993","19","6","625","639","A rely and guarantee method for timed communicating sequential processes (TCPSs), by which the behavior of a component belonging to a composite system is specified in terms of what it guarantees to its neighbors and what it relies on from them, is described. The method is illustrated using an overview of the specification of a plain old telephone service together with part of a design that provably satisfies this specification. The specification and design deal with safety, liveness, and troublesome race conditions.<<ETX>></ETX>","1939-3520","","10.1109/32.232027","","https://ieeexplore.ieee.org/stamp/stamp.jsp?arnumber=232027","","Telephony;Interconnected systems;Safety;Formal specifications;Switching systems;Protocols;Large-scale systems;Explosions;Europe;Concurrent computing","communicating sequential processes;formal specification;telecommunications computing;telephone exchanges","rely method;telephone exchange;guarantee method;timed communicating sequential processes;specification;telephone service;safety;liveness;troublesome race conditions","","21","","40","","6 Aug 2002","","","IEEE","IEEE Journals"
"Qualified Data Flow Problems","L. H. Holley; B. K. Rosen",IBM Cambridge Scientific Center; NA,"IEEE Transactions on Software Engineering","18 Sep 2006","1981","SE-7","1","60","78","It is known that not aU paths are possible in the run time control flow of many programs. It is also known that data flow analysis cannot restrict attention to exactly those paths that are possible. It is, therefore, usual for analytic methods to consider aU paths. Sharper information can be obtained by considering a recursive set of paths that is large enough to include aUl possible paths, but smaU enough to exclude many of the impossible ones. This paper presents a simple uniform methodology for sharpening data flow information by considering certain recursive path sets of practical importance. Associated with each control flow arc there is a relation on a finite set Q. The paths that qualify to be considered are (essentially) those for which the composition of the relations encountered is nonempty. For example, Q might be the set of all assignments of values to each of several bit variables used by a program to remember some facts about the past and branch accordingly in the future. Given any data-flow problem together with qualifying relations on Q associated with the control flow arcs, we construct a new problem. Considering all paths in the new problem is equivalent to considering only qualifying paths in the old one. Preliminary experiments (with a smaUl set of real programs) indicate that qualified analysis is feasible and substantialy more informative than ordinary analysis.","1939-3520","","10.1109/TSE.1981.234509","","https://ieeexplore.ieee.org/stamp/stamp.jsp?arnumber=1702803","Data flow analysis;global variable;interprocedural analysis;label variable;symbolic execution","Testing;Data analysis;Computer languages;Feedback;Assembly;Flowcharts;Constraint optimization;Operating systems;Algorithm design and analysis;Availability","","Data flow analysis;global variable;interprocedural analysis;label variable;symbolic execution","","25","","25","","18 Sep 2006","","","IEEE","IEEE Journals"
"The Impact of Irrelevant and Misleading Information on Software Development Effort Estimates: A Randomized Controlled Field Experiment","M. Jorgensen; S. Grimstad","University of Oslo and Simula Research Laboratory, Lysaker; University of Oslo and Simula Research Laboratory, Lysaker","IEEE Transactions on Software Engineering","29 Sep 2011","2011","37","5","695","707","Studies in laboratory settings report that software development effort estimates can be strongly affected by effort-irrelevant and misleading information. To increase our knowledge about the importance of these effects in field settings, we paid 46 outsourcing companies from various countries to estimate the required effort of the same five software development projects. The companies were allocated randomly to either the original requirement specification or a manipulated version of the original requirement specification. The manipulations were as follows: 1) reduced length of requirement specification with no change of content, 2) information about the low effort spent on the development of the old system to be replaced, 3) information about the client's unrealistic expectations about low cost, and 4) a restriction of a short development period with start up a few months ahead. We found that the effect sizes in the field settings were much smaller than those found for similar manipulations in laboratory settings. Our findings suggest that we should be careful about generalizing to field settings the effect sizes found in laboratory settings. While laboratory settings can be useful to demonstrate the existence of an effect and better understand it, field studies may be needed to study the size and importance of these effects.","1939-3520","","10.1109/TSE.2010.78","","https://ieeexplore.ieee.org/stamp/stamp.jsp?arnumber=5551161","Cost estimation;software psychology;requirements/specifications.","Estimation;Software;Companies;Laboratories;Programming;Materials;Project management","formal specification;software cost estimation","irrelevant information impact;misleading information impact;software development effort estimates;randomized controlled field experiment;software development projects;original requirement specification;laboratory settings;software psychology","","32","","31","","19 Aug 2010","","","IEEE","IEEE Journals"
"In Memoriam - David Notkin (1953-2013)","B. Nuseibeh",NA,"IEEE Transactions on Software Engineering","23 May 2013","2013","39","6","742","743","David Samuel Notkin, whose technical, educational, and social contributions to computer science and software engineering research made him a major figure in the field, died on 22 April 2013, at his home in Seattle, Washington. He was 58 years old. The cause of his death was cancer. David is best known for his research, with his many graduate students, on software evolution. He asked why software is often so hard and expensive to change, and he worked to reduce the difficulty of software evolution to an essential minimum. This focus came from his belief that the ability to change software - its softness - is where its true but under-realized potential resides. He asked questions such as whether we can identify and close the gap between Brooks' notions of accidental and essential software complexity? How much should rather than does it cost to develop, test, and evolve software? Can we make the cost of change proportionate rather than disproportionate to the apparent complexity of changes to be made? Can we design software analysis methods that realize the best properties of both static and dynamic analysis techniques? Beyond technical contributions, David is widely recognized and admired for his exceptional skill as a research mentor for graduate students and as a powerful and unwavering advocate for improving gender diversity in computer science. A brief biography is given highlighting Notkin's professional achievements.","1939-3520","","10.1109/TSE.2013.25","","https://ieeexplore.ieee.org/stamp/stamp.jsp?arnumber=6519247","","Obituaries;Notkin, David","","","","","","","","23 May 2013","","","IEEE","IEEE Journals"
