"Law review: What's new? Tracing the origin of species","K. J. Dakin","5675 DTC Blvd., Englewood, CO, USA","IEEE Software","6 Aug 2002","1995","12","2","99","100","One common question asked at the outset of a software-development project is if it is okay to create the new program. The simple and easy legal answer is that the law does not prohibit the development of new software. The reason the law is so crystal clear on the issue of developing new software is that it presumes a theoretical situation called independent development, in which new software is presumed to; be based solely on any new concepts or code; contain no old concepts or code; and contain the thoughts of only the participants of the development team. Independently developed software must be 100 percent original. The paper considers how it does not survive long when applied to situations in the real world. There is no such thing as new software that is truly and entirely original.<<ETX>></ETX>","1937-4194","","10.1109/52.368274","","https://ieeexplore.ieee.org/stamp/stamp.jsp?arnumber=368274","","Authorization;Licenses;Software quality;Loss measurement;Software measurement;Process design;Investments;Design methodology;Utility programs;Employment","software engineering;product liability;copyright","software-development project;legal answer;law;software development;independent development;development team;independently developed software;new software","","","","","","6 Aug 2002","","","IEEE","IEEE Magazines"
"Guest Editors' Introduction: Dynamically Typed Languages","L. Tratt; R. Wuyts",Bournemouth University; IMEC,"IEEE Software","17 Sep 2007","2007","24","5","28","30","The languages discussed in this special issue have a long history, which is perhaps why some have had several different names over the years. One such language is Lisp, the second-oldest programming language. For years, many somewhat dismissively described languages such as Lisp as ""scripting languages."" Today, we more commonly refer to them as dynamically typed languages, typified by Python and Ruby, and their impact is arguably greater than ever. This issue highlights the practical uses of such languages and shows how they're frequently a vehicle for innovation in the development sphere. This article is part of a special issue on dynamically typed languages.","1937-4194","","10.1109/MS.2007.140","","https://ieeexplore.ieee.org/stamp/stamp.jsp?arnumber=4302683","dynamically typed languages;Lisp;Python;Ruby;Smalltalk;Lua;CLOS","Programming profession;Software reusability;Application software;History;Java;Testing;Safety devices;IEEE news;Runtime;Computer languages","","","","3","","","","17 Sep 2007","","","IEEE","IEEE Magazines"
"Test Optimization Using Software Virtualization","S. Seetharaman; B. V. S. Krishna Murthy",Alcatel; Alcatel,"IEEE Software","6 Sep 2006","2006","23","5","66","69","Virtualization of operating systems has recently become a hype, although the concept is very old. Virtualization lets us group resources logically and thus abstract from the dependencies that physical implementations create. For operating systems, virtualization lets us reduce resource constraints and expenses for a multitude of interacting hardware and operating systems. This is helpful in scenarios with many such dependencies, such as testing. This article briefly introduces virtualization from a tester's perspective. It summarizes experiences and compares different virtualization approaches: architectural, logical, and physical. Only the test itself remains a necessary reality","1937-4194","","10.1109/MS.2006.143","","https://ieeexplore.ieee.org/stamp/stamp.jsp?arnumber=1687863","software testing;virtual machines;open source","Software testing;Hardware;Virtual manufacturing;Platform virtualization;Operating systems;Voice mail;Personal communication networks;Test equipment;Resource virtualization;Virtual machining","operating systems (computers);optimisation;program testing;virtual machines","software test optimization;software virtualization;operating system","","10","","3","","6 Sep 2006","","","IEEE","IEEE Magazines"
"Point/Counterpoint","I. Alexander; K. Beck","Three Rivers Institute, OR; NA","IEEE Software","5 Mar 2007","2007","24","2","62","65","The key to successful systems is building what the stakeholders desire. In a way, this point can hardly be gain.said: nobody wants to build what the stakeholders don't desire. But as usual, the devil is in the details. this paper contrasts two examples to illustrate what it can mean to build what stakeholders desire. There's an old saying in software development that the users don't know what they want until you give them what they asked for. Experienced developers often smile ruefully when they hear this, having been told at least once in their careers that a system they had delivered was totally unacceptable when it was exactly (as far as they could tell) what was requested. There's more to delivering good software than following orders. The paper describes what positive role developers can play in discovering and exploring requirements","1937-4194","","10.1109/MS.2007.50","","https://ieeexplore.ieee.org/stamp/stamp.jsp?arnumber=4118652","requirements engineering;software development;agile methods","Discrete wavelet transforms;Engineering profession;Costs;Eyes;Lead;Programming","formal specification;software development management;systems analysis","software development;requirements engineering;DWTTY;stakeholders requirements","","","","","","5 Mar 2007","","","IEEE","IEEE Magazines"
"Client-server user-interface testing","D. F. Mosley","Client-Server Software Testing Technol., Frontenac, MO, USA","IEEE Software","6 Aug 2002","1995","12","1","124","127","As client-server applications continue to replace mainframe-based systems, developers are looking for ways to adapt testing procedures for graphical user interfaces. Some advocate starting from scratch with new approaches; others see ways to amend old techniques and supplement them with new ones.<<ETX>></ETX>","1937-4194","","10.1109/52.363159","","https://ieeexplore.ieee.org/stamp/stamp.jsp?arnumber=363159","","Software testing;System testing;Graphical user interfaces;Application software;Software prototyping;Prototypes;Switches;Process control;Books;Software measurement","graphical user interfaces;program testing;client-server systems","user-interface testing;client-server applications;testing procedures;graphical user interfaces","","","1","4","","6 Aug 2002","","","IEEE","IEEE Magazines"
"Next-Generation Architects for a Harsh Business World","W. A. Risi",KPMG Argentina,"IEEE Software","20 Feb 2012","2012","29","2","9","12","Walter Ariel Risi proposes some patterns for hiring productive people that remind me of research done in the early days of patterns by Jim Coplien, who found that hyperproductive teams included, in many cases, musicians! In the old days, companies often hired smart people from other disciplines because software engineering or computer science hadn't joined the academic production of certified, degreed contributors. With the current focus now on degrees, I wonder if we've lost something important.","1937-4194","","10.1109/MS.2012.37","","https://ieeexplore.ieee.org/stamp/stamp.jsp?arnumber=6155136","personnel;HR;architects;traditional;nontraditional","Career development;Personnel;Engineering profession;Computer science education;Research and development","personnel;recruitment;software engineering","next generation architects;harsh business world;productive people hiring;hyperproductive team;musicians;smart people hiring;software engineering;computer science;academic production;degreed contributor","","1","","","","20 Feb 2012","","","IEEE","IEEE Magazines"
"A tale of three programs","G. J. Holzmann",Nimble Research,"IEEE Software","15 May 2017","2017","34","3","23","26","A look at the generation of prime numbers offers a cautionary tale about the perils of premature optimization. We can code this in any reasonable programming language, and in quite a few unreasonable ones as well. It can be fun to express the algorithm in Python, C, C++, Scala, or Go, or even in scripting languages such as Tcl or Awk. And, yes, I confess that I've tried most of these, including Awk. Each language offers different features that can simplify the job or make it more interesting. For our current purpose, it'll suffice to stick to just plain old C.In a first attempt, we might come up with the version in Figure 1, which assumes that we provide the value of N in some other way-for example, with a macro directive to the C compiler.","1937-4194","","10.1109/MS.2017.62","","https://ieeexplore.ieee.org/stamp/stamp.jsp?arnumber=7927921","prime numbers;recursion;Sieve of Eratosthenes;software development;software engineering;programming;Robert Morris Sr.","Mathematics;Encoding","C language;program compilers","programming language;scripting languages;C language;C compiler","","","","1","","15 May 2017","","","IEEE","IEEE Magazines"
"Body Sensors: Wireless Access to Physiological Data","A. D. Jurik; A. C. Weaver",University of Virginia; University of Virginia,"IEEE Software","22 Dec 2008","2009","26","1","71","73","An area often neglected in software technology is where software meets biology. We'll approach this topic with one of the major interfaces between human beings and information technology: body sensors. These sensors mostly operate as interfaces to relatively small software components attached to or implanted into human bodies, such as pacemakers. They provide bidirectional communication interfaces between a person and a remote information system that provides healthcare services, diagnosis, or upgrades. The authors offer an overview of this rather old yet fast-evolving technology and show how to cope with design constraints.","1937-4194","","10.1109/MS.2009.5","","https://ieeexplore.ieee.org/stamp/stamp.jsp?arnumber=4721186","body sensors;wireless communication;embedded software","Wireless sensor networks;Wearable sensors;Biosensors;Humans;Circuits;Sensor phenomena and characterization;Energy management;Technology management;Voltage;Information technology","biomedical telemetry;biosensors;body area networks;health care;wireless sensor networks","body sensors;wireless access;physiological data;software technology;information technology;software components;pacemakers;bidirectional communication interfaces;remote information system;healthcare services;healthcare diagnosis;healthcare upgrades","","9","","","","22 Dec 2008","","","IEEE","IEEE Magazines"
"Git","D. Spinellis",Athens University of Economics and Business,"IEEE Software","20 Apr 2012","2012","29","3","100","101","Git is a distributed revision control system available on all mainstream development platforms through a free software license. An important difference of git over its older ancestors is that it elevates the software's revisions to first-class citizens. Developers care deeply about software revisions, and git supports this by giving each developer a complete private copy of the software repository and numerous ways to manage revisions within its context. The ability to associate a local repository with numerous remote ones allows developers and their managers to build a variety of interesting distributed workflows, most of which are impossible to run on a traditional centralized version control system. The local repository also makes git responsive, easy to setup, and able to operate without Internet connectivity. GitHub is a git repository hosting provider that simplifies many repository management tasks through a Web-based user interface while also promoting cooperation in open source projects.","1937-4194","","10.1109/MS.2012.61","","https://ieeexplore.ieee.org/stamp/stamp.jsp?arnumber=6188603","git;distributed version control;GitHub;configuration management","History;Control systems;Economics;Cloning;Kernel;Business","","","","11","","","","20 Apr 2012","","","IEEE","IEEE Magazines"
"Like a River","G. Booch",IBM,"IEEE Software","17 Apr 2009","2009","26","3","10","11","The metaphor of software development as building construction is an old one. Here is a fresh perspective, considering the life cycle of a software-intensive system as a river.","1937-4194","","10.1109/MS.2009.74","","https://ieeexplore.ieee.org/stamp/stamp.jsp?arnumber=4814951","life cycle;software-intensive systems","Rivers;Computer architecture;Societies;Reconnaissance;Solids;Sea surface;Marine animals;Lakes;Springs;Oceans","","","","","","","","17 Apr 2009","","","IEEE","IEEE Magazines"
"Software's invisible users","J. A. Whittaker","Dept. of Comput. Sci., Florida Tech., Melbourne, FL, USA","IEEE Software","7 Aug 2002","2001","18","3","84","88","Software is deterministic. Given a starting state and a fixed series of inputs, software will produce the exact same output every single time those inputs are applied. In fact, many of the technologies we apply during development (reviews, formal proofs, testing, and so forth) rely on this determinism; they would not work otherwise. But if software is deterministic, why do weird things happen? Why is it that we can apply a sequence of inputs and observe a failure and then be unable to reproduce that failure? Why does software work on one machine and fail on another? How is it that you can return from lunch and find your Web browser has crashed when it wasn't being used? The answer is, of course, that modern software processes an enormous number of inputs and only a small percentage of these inputs originate from human users. When testers can't reproduce failures, the reason is that they are only resubmitting the human input without sufficient regard to the operating system return codes and input from runtime libraries. When software fails on a new computer after running successfully on another, the reason can only be that the new system is supplying input that differs in content from the old one. And the browser that crashes when you are at lunch is responding to input from a nonhuman external resource.","1937-4194","","10.1109/52.922730","","https://ieeexplore.ieee.org/stamp/stamp.jsp?arnumber=922730","","Application software;Kernel;Humans;Software tools;Software testing;Software systems;Event detection;Computer interfaces;Watches;Libraries","system recovery;operating systems (computers);software reliability","invisible software users;deterministic software;software failure;Web browser;input processing;human users;human input;operating system return codes;runtime libraries;nonhuman external resource","","17","","5","","7 Aug 2002","","","IEEE","IEEE Magazines"
"Where Have All the Stencils Gone?","C. Codephirst",consultant,"IEEE Software","19 Jun 2009","2009","26","4","91","92","Requirements analysts rarely use manual stencils nowadays. Technological advances mean that analysts can draw many types of diagrams. In this column, invited columnist Colin Codephirst asks whether this is progress, reflects on the advantages of old-style stencils, and muses on whether these stencils offered some advantages that have been forgotten. He outlines the requirements for a new stencil for analysts in the 21st century.","1937-4194","","10.1109/MS.2009.108","","https://ieeexplore.ieee.org/stamp/stamp.jsp?arnumber=5076466","requirements analysis;methods;stencils","Shape;Pediatrics;Dinosaurs;Educational institutions;Flowcharts;Resists;Software tools;Filters;Cultural differences;Global communication","diagrams;flowcharting","stencils;requirements analyst;technological advances","","","","","","19 Jun 2009","","","IEEE","IEEE Magazines"
"Requirements in the medical domain: Experiences and prescriptions","A. Tveito; P. Hasvold","iMed Norwegian Telemedicine, Norway; NA","IEEE Software","16 Dec 2002","2002","19","6","66","69","Research shows that information flow in health care systems is inefficient and prone to error. Data is lost, and physicians must repeat tests and examinations because the results are unavailable at the right place and time. Cases of erroneous medication - resulting from misinterpreted, misunderstood, or missing information - are well known and have caused serious health problems and even death. We strongly believe that through effective use of information technology, we can improve both the quality and efficiency of the health sector's work. Introducing a new system might shift power from old to young, from doctor to nurse, or from medical staff to administration. Few people appreciate loss of power, but even fewer will admit that the loss of power is why they resist the new system. Thus, we must work hard to bring this into the open and help people realize that a new system doesn't have to threaten their positions. Again, knowledge and understanding of a hospital's organizational structure, both official and hidden, is necessary if the system's introduction is to be successful.","1937-4194","","10.1109/MS.2002.1049394","","https://ieeexplore.ieee.org/stamp/stamp.jsp?arnumber=1049394","","Costs;Hospitals;Paramagnetic resonance;Europe;Investments;Biomedical engineering;Knowledge engineering;Contracts;Medical services;Particle measurements","medical computing;systems re-engineering;formal specification;formal verification","information flow;health care systems;erroneous medication;information technology;workload;productivity;bureaucracy;health care personnel;unconscious requirements;administration;understanding;knowledge;organizational structure","","4","","3","","16 Dec 2002","","","IEEE","IEEE Magazines"
"Y2K: don't play it again, Sam","J. Sanders",NA,"IEEE Software","6 Aug 2002","1998","15","3","100","102","Judging by how many Year 2000 press releases cross the author's desk each month, making software Y2K compliant is a booming business. Warnings of calamity mixed with promises of an easy fix-its the same old tune over and over again. How much faith would you have in the legal profession, for example, if legions of attorneys aggressively sought to take on cases that involved suing their fellow lawyers for malpractice? Yet this is uncomfortably like what many in our industry do today: bill clients to fix problems caused by other software developers. If we are ever to be taken seriously as a profession or engineering discipline, we must look past the Y2K hype and hysteria to determine how the problem emerged, why it emerged, and what we can do to avoid similar situations in the future.","1937-4194","","10.1109/52.676971","","https://ieeexplore.ieee.org/stamp/stamp.jsp?arnumber=676971","","Glass;Databases;Application software;Companies;Computer industry;Time measurement;Costs;Read-write memory;Hard disks;Programming","software development management;software maintenance;professional aspects","Year 2000 press releases;Y2K compliant;software developers;engineering discipline;profession;Y2K hype","","1","","","","6 Aug 2002","","","IEEE","IEEE Magazines"
"Rational Metaprogramming","D. Spinellis",Athens University of Economics and Business,"IEEE Software","7 Jan 2008","2008","25","1","78","79","Metaprogramming, using programs to manipulate other programs, is as old as programming. From self-modifying machine code in early computers to expressions involving partially applied functions in modern functional-programming languages, metaprogramming is an essential part of an advanced programmer's arsenal. Everyday metaprogramming involves on-the-fly code production. Representative examples include dynamically generated SQL statements and code created for evaluation at runtime in interpreted languages. Metaprogramming also occurs in programs that spew out HTML or XML. Although we can't classify these markup languages as code, their rich syntactic structure qualifies their generation as metaprogramming. Unfortunately, we commonly produce code on the fly by simply pasting together character strings. This means that it's difficult to verify essential properties of the generated code - such as validity, correctness, and safety - at compile time.","1937-4194","","10.1109/MS.2008.15","","https://ieeexplore.ieee.org/stamp/stamp.jsp?arnumber=4420074","metaprogramming;functional programming;templates;generative programming","Computer languages;Java;Libraries;DSL;Power generation;Instruments;Computer bugs;Production;Runtime;HTML","object-oriented programming;program compilers;program verification;software tools;SQL","rational metaprogramming;self-modifying machine code;functional-programming languages;SQL statements;HTML;XML;code generation;program verification","","2","","","","7 Jan 2008","","","IEEE","IEEE Magazines"
"Open Collaboration, Data Quality, and COVID-19","G. Hampson; N. Hargreaves; H. Jakubowicz; G. Williams; L. Hatton",NA; NA; NA; NA; NA,"IEEE Software","19 Apr 2021","2021","38","3","137","141","The flavor of this ""Impact"" department is somewhat different. In a pandemic, everybody has to come together. In April 2020, a call went out in the United Kingdom for groups to informally form and collaborate to study this brutal pathogen in whatever way they could. The five authors of this article, old friends from the geophysical industry with decades of experience in numerical modeling and big data, formed such a group.","1937-4194","","10.1109/MS.2021.3056642","","https://ieeexplore.ieee.org/stamp/stamp.jsp?arnumber=9407288","","Industries;Pathogens;Pandemics;Data integrity;Collaboration;Data models;Numerical models","Big Data;data integrity;diseases;epidemics;medical computing;microorganisms","data quality;COVID-19;United Kingdom;pathogen;geophysical industry;numerical modeling;Big Data;pandemic","","","","7","IEEE","19 Apr 2021","","","IEEE","IEEE Magazines"
"Managing requirements for business value","J. Favare",NA,"IEEE Software","7 Aug 2002","2002","19","2","15","17","Managing requirements for business value? What's there to manage? Aren't they just...there?"" Such perplexity was perfectly understandable in the good old days, when all you had to do was get the requirements from your customer, design your system, and produce one of those awful conformance matrices that demonstrated that you had implemented each and every one of the requirements in your system. Against this dreary backdrop of conformance matrices and the like, it is indeed hard to imagine a role for requirements in the development and execution of business strategy. But, as the song says, the times, they are a changin'. We are now looking outside the traditional boundaries and developing ways of getting maximum business value from our investment in requirements. This paper discusses three ways of realizing this value: managed requirements process, requirements agility, and contractual innovation.","1937-4194","","10.1109/52.991325","","https://ieeexplore.ieee.org/stamp/stamp.jsp?arnumber=991325","","Investments;Disaster management;Design engineering;Innovation management;Technological innovation;Robustness;Humans;Costs;Financial management;Software development management","systems analysis;formal specification","requirements management;conformance matrices;managed requirements process;requirements agility;contractual innovation","","17","","4","","7 Aug 2002","","","IEEE","IEEE Magazines"
"Point/Counterpoint","J. Singer; M. Vigder; J. Segal; S. Clarke",National Research Council Canada; National Research Council Canada; Open University; Microsoft,"IEEE Software","25 Aug 2009","2009","26","5","54","57","Tools help end users develop software, but they're effective only when combined with a basic understanding of software engineering. Given this proliferation of new and old capabilities, how will end users exploit the programming possibilities available to them? Will tools to support end users be enough - or should everyone be taught some form of software engineering literacy? We believe we need a new literacy: not just reading, writing, and arithmetic, but the 3 Rs + SE. With such an education, end users will have greater success customizing environments and manipulating digital information correctly and thoughtfully.","1937-4194","","10.1109/MS.2009.135","","https://ieeexplore.ieee.org/stamp/stamp.jsp?arnumber=5222795","end-user programming;software engineering;version control;configuration management;software testing;debugging;software maintenance","Software engineering;Programming profession;Collaborative work;Collaborative tools;Application software;Collaborative software;Control systems;Engineering management;Software tools;Cellular phones","computer science education;programming;reverse engineering;software tools;teaching","end-user programming teaching;software engineering literacy;software tools;software development;software understanding;SE education;software environment customization;digital information manipulation;reading-writing-and-arithmetic;3 Rs","","","","","","25 Aug 2009","","","IEEE","IEEE Magazines"
